state,bill_number,bill_id,url,text_url,last_action_date,last_action,title
NV,AB144,1204678,https://legiscan.com/NV/bill/AB144/2019,https://legiscan.com/NV/text/AB144/2019,2019-04-13,"(Pursuant to Joint Standing Rule No. 14.3.1, no further action allowed.)",Proposes to exempt sales of diapers from sales and use taxes and analogous taxes upon approval by the voters. (BDR 32-275)
IL,HB3249,1205891,https://legiscan.com/IL/bill/HB3249/2019,https://legiscan.com/IL/text/HB3249/2019,2019-07-12,Public Act . . . . . . . . . 101-0081,FIRST 2019 GENERAL REVISORY
IL,HB3266,1206140,https://legiscan.com/IL/bill/HB3266/2019,https://legiscan.com/IL/text/HB3266/2019,2019-03-29,Rule 19(a) / Re-referred to Rules Committee,BIDS-OCCUPATION/USE EXEMPTION
IL,HB3034,1206240,https://legiscan.com/IL/bill/HB3034/2019,https://legiscan.com/IL/text/HB3034/2019,2019-03-29,Rule 19(a) / Re-referred to Rules Committee,USE/OCC TX-AGRICULTURE
IL,HB3212,1206295,https://legiscan.com/IL/bill/HB3212/2019,https://legiscan.com/IL/text/HB3212/2019,2019-03-29,Rule 19(a) / Re-referred to Rules Committee,IL FIRST STEP
IL,HB3572,1206558,https://legiscan.com/IL/bill/HB3572/2019,https://legiscan.com/IL/text/HB3572/2019,2019-03-29,Rule 19(a) / Re-referred to Rules Committee,USE/OCC TX-CENTRAL PURCHASING
IL,HB3573,1206778,https://legiscan.com/IL/bill/HB3573/2019,https://legiscan.com/IL/text/HB3573/2019,2019-03-29,Rule 19(a) / Re-referred to Rules Committee,USE/OCC TX-MPC
IL,HB3523,1206787,https://legiscan.com/IL/bill/HB3523/2019,https://legiscan.com/IL/text/HB3523/2019,2020-05-22,"Added Co-Sponsor Rep. Jonathan ""Yoni"" Pizer",USE/OCC TX-VETERANS
IL,SB1591,1206832,https://legiscan.com/IL/bill/SB1591/2019,https://legiscan.com/IL/text/SB1591/2019,2019-08-02,Public Act . . . . . . . . . 101-0207,USE/OCC TAX-DATA CENTERS
IL,HB3306,1206837,https://legiscan.com/IL/bill/HB3306/2019,https://legiscan.com/IL/text/HB3306/2019,2019-03-29,Rule 19(a) / Re-referred to Rules Committee,BIG EMPTIES ACT
IL,SB1678,1207045,https://legiscan.com/IL/bill/SB1678/2019,https://legiscan.com/IL/text/SB1678/2019,2021-01-13,Session Sine Die,USE/OCC TX-BEEKEEPING
IL,SB1555,1207248,https://legiscan.com/IL/bill/SB1555/2019,https://legiscan.com/IL/text/SB1555/2019,2021-01-13,Session Sine Die,USE/OCC TX-MOTOR FUEL
IL,HB3470,1207339,https://legiscan.com/IL/bill/HB3470/2019,https://legiscan.com/IL/text/HB3470/2019,2019-03-29,Rule 19(a) / Re-referred to Rules Committee,USE/OCC TX-NONPROFIT MEALS
IL,HB3412,1207373,https://legiscan.com/IL/bill/HB3412/2019,https://legiscan.com/IL/text/HB3412/2019,2019-03-29,House Committee Amendment No. 1 Rule 19(c) / Re-referred to Rules Committee,USE/OCC TAX-DATA CENTERS
IL,SB1676,1207524,https://legiscan.com/IL/bill/SB1676/2019,https://legiscan.com/IL/text/SB1676/2019,2021-01-13,Session Sine Die,USE/OCC TX-MULTISTATE
IL,SB2036,1207799,https://legiscan.com/IL/bill/SB2036/2019,https://legiscan.com/IL/text/SB2036/2019,2021-01-13,Session Sine Die,BIG EMPTIES ACT
GA,HR242,1208153,https://legiscan.com/GA/bill/HR242/2019,https://legiscan.com/GA/text/HR242/2019,2019-02-15,House Read and Adopted,"Ward, Timothy C.; commend"
GA,HR245,1208168,https://legiscan.com/GA/bill/HR245/2019,https://legiscan.com/GA/text/HR245/2019,2019-02-15,House Read and Adopted,"Bryson, Homer; commend"
LA,SB5,1208460,https://legiscan.com/LA/bill/SB5/2019,https://legiscan.com/LA/text/SB5/2019,2019-06-05,Notice House Conference Committee members appointed.,"Exempts diapers and feminine hygiene products from sales and use tax. (1/1/21) (RRF -$14,500,000 GF RV See Note)"
LA,SB4,1208628,https://legiscan.com/LA/bill/SB4/2019,https://legiscan.com/LA/text/SB4/2019,2019-05-09,"Reconsidered. Read by title; returned to the Calendar, subject to call.",Constitutional amendment to exempt diapers and feminine hygiene products from state sales and use tax. (2/3 - CA13s1(A)) (RE DECREASE GF RV See Note)
IA,SF311,1210587,https://legiscan.com/IA/bill/SF311/2019,https://legiscan.com/IA/text/SF311/2019,2019-02-21,"Subcommittee: Sinclair, Cournoyer, and Wahls. S.J. 380.",A bill for an act providing for access to feminine hygiene products in public school restrooms.
CA,AB732,1210898,https://legiscan.com/CA/bill/AB732/2019,https://legiscan.com/CA/text/AB732/2019,2020-08-29,Read third time. Passed. Ordered to the Assembly. (Ayes 33. Noes 1. Page 4432.).,County jails: prisons: incarcerated pregnant persons.
RI,S0264,1211264,https://legiscan.com/RI/bill/S0264/2019,https://legiscan.com/RI/text/S0264/2019,2019-04-24,Committee recommended measure be held for further study,Health And Safety Of Pupils
IA,HF462,1211402,https://legiscan.com/IA/bill/HF462/2019,https://legiscan.com/IA/text/HF462/2019,2020-01-22,"Subcommittee reassigned: Hagenow, Hein and Jacoby. H.J. 122.",A bill for an act exempting the sale of feminine hygiene products from the sales tax.
OR,HB3020,1212480,https://legiscan.com/OR/bill/HB3020/2019,https://legiscan.com/OR/text/HB3020/2019,2019-06-30,In committee upon adjournment.,Relating to menstrual products in schools; prescribing an effective date.
TX,HB2169,1213030,https://legiscan.com/TX/bill/HB2169/2019,https://legiscan.com/TX/text/HB2169/2019,2019-06-14,Effective on 9/1/19,Relating to reporting concerning female prisoners who are confined in county jails and to the provision of feminine hygiene products to female prisoners.
CA,AB1672,1215751,https://legiscan.com/CA/bill/AB1672/2019,https://legiscan.com/CA/text/AB1672/2019,2020-08-20,In committee: Held under submission.,Solid waste: premoistened nonwoven disposable wipes.
GA,HB475,1217149,https://legiscan.com/GA/bill/HB475/2019,https://legiscan.com/GA/text/HB475/2019,2019-02-27,House Second Readers,"Penal institutions; provide matters related to the housing, health, and care of female inmates"
NC,H185,1217439,https://legiscan.com/NC/bill/H185/2019,https://legiscan.com/NC/text/H185/2019,2019-02-27,"Ref to the Com on Health, if favorable, Finance, if favorable, Rules, Calendar, and Operations of the House",The SAVE Act
MI,SB0123,1217609,https://legiscan.com/MI/bill/SB0123/2019,https://legiscan.com/MI/text/SB0123/2019,2019-02-26,Referred To Committee On Finance,Sales tax; exemptions; sale of feminine hygiene products; exempt. Amends sec. 4a of 1933 PA 167 (MCL 205.54a).
MO,SB443,1217733,https://legiscan.com/MO/bill/SB443/2019,https://legiscan.com/MO/text/SB443/2019,2019-03-07,Second Read and Referred S Ways and Means Committee,Imposes a reduced sales tax rate on certain products
MI,SB0124,1217801,https://legiscan.com/MI/bill/SB0124/2019,https://legiscan.com/MI/text/SB0124/2019,2019-02-26,Referred To Committee On Finance,Use tax; exemptions; sale of feminine hygiene products; exempt. Amends sec. 4 of 1937 PA 94 (MCL 205.94).
NC,S143,1218677,https://legiscan.com/NC/bill/S143/2019,https://legiscan.com/NC/text/S143/2019,2019-02-27,Ref To Com On Rules and Operations of the Senate,The SAVE Act
MA,H1486,1218692,https://legiscan.com/MA/bill/H1486/2019,https://legiscan.com/MA/text/H1486/2019,2020-11-12,"Accompanied a study order, see H5081",To reduce recidivism among emerging adults
MA,H565,1218693,https://legiscan.com/MA/bill/H565/2019,https://legiscan.com/MA/text/H565/2019,2020-01-15,"Accompanied a new draft, see H4293",Concerning feminine hygiene products in schools
MA,H1959,1220469,https://legiscan.com/MA/bill/H1959/2019,https://legiscan.com/MA/text/H1959/2019,2020-06-22,"Reporting date extended to Thursday December 31, 2020, pending concurrence","To increase access to disposable menstrual products in prisons, homeless shelters, and public schools"
MN,HF1914,1225624,https://legiscan.com/MN/bill/HF1914/2019,https://legiscan.com/MN/text/HF1914/2019,2020-04-30,Second reading,"Advanced practice registered nurses added to certain statutes, and medical assistance coverage expanded to orthotic devices."
MA,S940,1225923,https://legiscan.com/MA/bill/S940/2019,https://legiscan.com/MA/text/S940/2019,2020-02-03,"Accompanied a study order, see S2496",To reduce recidivism among emerging adults
MA,S1274,1227195,https://legiscan.com/MA/bill/S1274/2019,https://legiscan.com/MA/text/S1274/2019,2019-12-30,Bill reported favorably by committee and referred to the committee on Senate Ways and Means,"To increase access to disposable menstrual products in prisons, homeless shelters, and public schools"
MN,SF1966,1227816,https://legiscan.com/MN/bill/SF1966/2019,https://legiscan.com/MN/text/SF1966/2019,2020-02-27,Second reading,Advanced practice registered nurses provisions modifications
MN,HF2060,1229064,https://legiscan.com/MN/bill/HF2060/2019,https://legiscan.com/MN/text/HF2060/2019,2019-03-07,Author added Moran as Chief Author,"Housing, health care, chemical and mental health, older adults continuing care, operations, direct care and treatment, child and family services, and disability services policy provisions modified."
US,SB661,1230934,https://legiscan.com/US/bill/SB661/2019,https://legiscan.com/US/text/SB661/2019,2019-03-05,Read twice and referred to the Committee on the Judiciary.,Child Trafficking Victims Protection and Welfare Act of 2019
NJ,A5143,1231386,https://legiscan.com/NJ/bill/A5143/2018,https://legiscan.com/NJ/text/A5143/2018,2019-03-05,"Introduced, Referred to Assembly Women and Children Committee",Requires ingredients of menstrual products to be listed on package.
CO,HB1224,1232521,https://legiscan.com/CO/bill/HB1224/2019,https://legiscan.com/CO/text/HB1224/2019,2019-04-25,Governor Signed,Free Menstrual Hygiene Products In Custody
TX,HB3719,1232669,https://legiscan.com/TX/bill/HB3719/2019,https://legiscan.com/TX/text/HB3719/2019,2019-03-19,Referred to Public Education,Relating to human sexuality education in public schools.
OH,SB95,1233359,https://legiscan.com/OH/bill/SB95/2019,https://legiscan.com/OH/text/SB95/2019,2020-12-17,Informally passed,Enhance tax inducements for fixed asset and employment investment
MN,HF2185,1233572,https://legiscan.com/MN/bill/HF2185/2019,https://legiscan.com/MN/text/HF2185/2019,2019-03-18,Second reading,Disability services policy provisions modified.
US,SB697,1234627,https://legiscan.com/US/bill/SB697/2019,https://legiscan.com/US/text/SB697/2019,2019-03-07,Read twice and referred to the Committee on the Judiciary.,Next Step Act of 2019
MN,SF2247,1235338,https://legiscan.com/MN/bill/SF2247/2019,https://legiscan.com/MN/text/SF2247/2019,2019-03-11,Referred to Human Services Reform Finance and Policy,Human services disability services policy provisions modifications
MO,HCB2,1236909,https://legiscan.com/MO/bill/HCB2/2019,https://legiscan.com/MO/text/HCB2/2019,2019-05-10,"Dropped from Calendar - Pursuant to House Rules (H) - May 9, 2019",Modifies provisions relating to criminal justice.
MI,HR0039,1237447,https://legiscan.com/MI/bill/HR0039/2019,https://legiscan.com/MI/text/HR0039/2019,2019-03-12,Referred To Committee On Health Policy,A resolution to memorialize the Congress of the United States to amend the Internal Revenue Code to allow feminine-hygiene products to qualify as an eligible expense under flexible spending accounts.
MN,SF2570,1240236,https://legiscan.com/MN/bill/SF2570/2019,https://legiscan.com/MN/text/SF2570/2019,2019-03-21,Author added Hoffman,Omnibus health and human services policy bill
MN,SF2604,1241407,https://legiscan.com/MN/bill/SF2604/2019,https://legiscan.com/MN/text/SF2604/2019,2020-03-16,Author added Pappas,Menstrual products freely available in school restrooms requirement
AL,SB156,1242516,https://legiscan.com/AL/bill/SB156/2019,https://legiscan.com/AL/text/SB156/2019,2019-03-20,Read for the first time and referred to the Senate committee on Healthcare,"Nursing, Board of, scope of practice of Certified Registered Nurse Anesthetists revised, authorized to practice in coordination with a licensed physician, Sec. 34-21-81 am'd."
US,HB1846,1243260,https://legiscan.com/US/bill/HB1846/2019,https://legiscan.com/US/text/HB1846/2019,2019-03-22,Referred to the Subcommittee on Health.,End Diaper Need Act of 2019
GA,HR647,1243663,https://legiscan.com/GA/bill/HR647/2019,https://legiscan.com/GA/text/HR647/2019,2019-03-26,House Second Readers,"House Study Committee on Addressing Period (or Menstruation) Poverty in Girls in Elementary, Middle, and High Schools in Need in Georgia; create"
DC,B23-0209,1243831,https://legiscan.com/DC/bill/B23-0209/2019,https://legiscan.com/DC/text/B23-0209/2019,2020-02-11,Committee Report Filed,Fiscal Year 2020 Budget Support Act of 2019
US,HB1893,1245119,https://legiscan.com/US/bill/HB1893/2019,https://legiscan.com/US/text/HB1893/2019,2019-04-08,"Referred to the Subcommittee on Crime, Terrorism, and Homeland Security.",Next Step Act of 2019
US,HB1882,1245158,https://legiscan.com/US/bill/HB1882/2019,https://legiscan.com/US/text/HB1882/2019,2019-05-03,"Referred to the Subcommittee on Crime, Terrorism, and Homeland Security.",Menstrual Equity For All Act of 2019
PA,HB1008,1245719,https://legiscan.com/PA/bill/HB1008/2019,https://legiscan.com/PA/text/HB1008/2019,2019-04-02,Referred to JUDICIARY,"In miscellaneous provisions relating to inmate confinement, providing for feminine hygiene products."
GA,HB714,1246503,https://legiscan.com/GA/bill/HB714/2019,https://legiscan.com/GA/text/HB714/2019,2019-04-02,House Second Readers,Penal institutions; punishment; revise provisions
AL,HB308,1248011,https://legiscan.com/AL/bill/HB308/2019,https://legiscan.com/AL/text/HB308/2019,2019-05-23,"Delivered to Governor at 9:45 a.m. on May 23, 2019.","County jails and state penitentiaries, prisoners, sheriff and Dept. of Corrections, required to provide feminine hygiene products to female inmates, Secs. 14-3-44, 14-6-19 am'd."
US,HB2034,1248149,https://legiscan.com/US/bill/HB2034/2019,https://legiscan.com/US/text/HB2034/2019,2019-05-15,"Referred to the Subcommittee on Crime, Terrorism, and Homeland Security.",Dignity Act Dignity for Incarcerated Women Act of 2019
US,SB992,1248171,https://legiscan.com/US/bill/SB992/2019,https://legiscan.com/US/text/SB992/2019,2019-04-02,Read twice and referred to the Committee on the Judiciary.,Dignity Act Dignity for Incarcerated Women Act of 2019
US,HB2268,1251165,https://legiscan.com/US/bill/HB2268/2019,https://legiscan.com/US/text/HB2268/2019,2019-04-11,Referred to the Subcommittee on Health.,Menstrual Products Right To Know Act of 2019
IL,HB3832,1251421,https://legiscan.com/IL/bill/HB3832/2019,https://legiscan.com/IL/text/HB3832/2019,2019-04-11,Referred to Rules Committee,USE/OCC TAX-SCHOOL BUS
OH,HB197,1251489,https://legiscan.com/OH/bill/HB197/2019,https://legiscan.com/OH/text/HB197/2019,2020-03-27,Effective 3/27/20,Make technical and corrective changes to tax law
IL,SB2250,1251628,https://legiscan.com/IL/bill/SB2250/2019,https://legiscan.com/IL/text/SB2250/2019,2021-01-13,Session Sine Die,USE/OCC TAX-SCHOOL BUS
PA,HB1231,1252532,https://legiscan.com/PA/bill/HB1231/2019,https://legiscan.com/PA/text/HB1231/2019,2019-04-17,Referred to FINANCE,"Providing for tax levies and information related to taxes; authorizing the imposition of a personal income tax or an earned income tax by a school district subject to voter approval; providing for education tax and for imposition of and exclusions from a sales and use tax for the elimination of residential property taxes; establishing the Public Transportation Reserve Fund; providing for increase to the personal income tax, for certain licenses, for hotel occupancy tax, for procedure and administration of the tax, for expiration of authority to issue certain debt and for reporting by local government units of debt outstanding; establishing the Residential Property Tax Elimination Fund; providing for disbursements from this fund and for certain rebates and assistance to senior citizens; and repealing sales tax provisions of the Tax Reform Code of 1971 and earned income tax of the Taxpayer Relief Act."
NC,H988,1254499,https://legiscan.com/NC/bill/H988/2019,https://legiscan.com/NC/text/H988/2019,2019-04-26,"Ref to the Com on Appropriations, Justice and Public Safety, if favorable, Rules, Calendar, and Operations of the House",Next Step Act
MN,HF2861,1254861,https://legiscan.com/MN/bill/HF2861/2019,https://legiscan.com/MN/text/HF2861/2019,2019-05-02,Author added Lucero,Income and business taxes eliminated and sales tax replaced with a fair tax.
US,HB2403,1255636,https://legiscan.com/US/bill/HB2403/2019,https://legiscan.com/US/text/HB2403/2019,2019-05-01,"Referred to the Subcommittee on Economic Development, Public Buildings, and Emergency Management.",Menstrual Hygiene Products in Federal Buildings Act
US,SB1404,1259973,https://legiscan.com/US/bill/SB1404/2019,https://legiscan.com/US/text/SB1404/2019,2019-05-09,Read twice and referred to the Committee on Finance.,End Diaper Need Act of 2019
NJ,S3645,1260448,https://legiscan.com/NJ/bill/S3645/2018,https://legiscan.com/NJ/text/S3645/2018,2019-06-17,Referred to Senate Budget and Appropriations Committee,Requires school districts to provide feminine hygiene products in certain public schools and requires State to pay costs.
NY,S06088,1261945,https://legiscan.com/NY/bill/S06088/2019,https://legiscan.com/NY/text/S06088/2019,2020-01-08,"REFERRED TO CRIME VICTIMS, CRIME AND CORRECTION",Relates to replacing all instances of the words or variations of the words inmate or inmates with the words incarcerated individual or incarcerated individuals or variation thereof.
MN,HF2903,1262366,https://legiscan.com/MN/bill/HF2903/2019,https://legiscan.com/MN/text/HF2903/2019,2020-02-24,Author added Jordan,Schools required to make disposable menstrual products freely available in school restrooms.
AL,SR83,1263501,https://legiscan.com/AL/bill/SR83/2019,https://legiscan.com/AL/text/SR83/2019,2019-05-21,Waggoner motion to Adopt adopted Roll Call 912,"Senate, Special Order Calendar"
US,HR406,1264559,https://legiscan.com/US/bill/HR406/2019,https://legiscan.com/US/text/HR406/2019,2019-05-28,Sponsor introductory remarks on measure. (CR E677),Supporting the goals and ideals of Menstrual Hygiene Day.
NY,A07866,1264696,https://legiscan.com/NY/bill/A07866/2019,https://legiscan.com/NY/text/A07866/2019,2020-01-08,referred to correction,Relates to replacing all instances of the words or variations of the words inmate or inmates with the words incarcerated individual or incarcerated individuals or variation thereof.
OR,HB3446,1266283,https://legiscan.com/OR/bill/HB3446/2019,https://legiscan.com/OR/text/HB3446/2019,2019-06-30,In committee upon adjournment.,Relating to the exemption of certain receipts from the corporate activity tax; prescribing an effective date.
MI,HR0113,1266410,https://legiscan.com/MI/bill/HR0113/2019,https://legiscan.com/MI/text/HR0113/2019,2019-06-04,Adopted,"A resolution to declare May 28, 2019, as Menstrual Hygiene Day in the state of Michigan."
US,HB3239,1268169,https://legiscan.com/US/bill/HB3239/2019,https://legiscan.com/US/text/HB3239/2019,2019-07-25,Received in the Senate and Read twice and referred to the Committee on the Judiciary.,Humanitarian Standards for Individuals in Customs and Border Protection Custody Act
DC,B23-0352,1269946,https://legiscan.com/DC/bill/B23-0352/2019,https://legiscan.com/DC/text/B23-0352/2019,2019-07-26,"Act A23-0091 Published in DC Register Vol 66 and Page 8497, Expires on Oct 20, 2019",Fiscal Year 2020 Budget Support Emergency Act of 2019
NJ,A5670,1270085,https://legiscan.com/NJ/bill/A5670/2018,https://legiscan.com/NJ/text/A5670/2018,2019-06-24,"Introduced, Referred to Assembly Women and Children Committee",Requires Commissioner of Health to establish public awareness campaign on toxic shock syndrome.
US,HB3524,1270660,https://legiscan.com/US/bill/HB3524/2019,https://legiscan.com/US/text/HB3524/2019,2019-08-02,"Referred to the Subcommittee on Border Security, Facilitation, and Operations.",Northern Triangle and Border Stabilization Act
DC,B23-0367,1270878,https://legiscan.com/DC/bill/B23-0367/2019,https://legiscan.com/DC/text/B23-0367/2019,2019-09-13,"Act A23-0112 Published in DC Register Vol 66 and Page 11964, Expires on Dec 02, 2019",Fiscal Year 2020 Budget Support Congressional Review Emergency Act of 2019
PA,HB1708,1270900,https://legiscan.com/PA/bill/HB1708/2019,https://legiscan.com/PA/text/HB1708/2019,2019-07-16,Referred to EDUCATION,"In school health services, providing for menstrual hygiene products."
US,HB3729,1271358,https://legiscan.com/US/bill/HB3729/2019,https://legiscan.com/US/text/HB3729/2019,2019-08-06,Referred to the Subcommittee on Immigration and Citizenship.,Child Trafficking Victims Protection and Welfare Act
US,HB3731,1271387,https://legiscan.com/US/bill/HB3731/2019,https://legiscan.com/US/text/HB3731/2019,2019-07-30,Referred to the Subcommittee on Immigration and Citizenship.,Strategic and Humane Southern Border Migrant Response Act
US,SB2113,1271507,https://legiscan.com/US/bill/SB2113/2019,https://legiscan.com/US/text/SB2113/2019,2019-07-15,Read twice and referred to the Committee on the Judiciary.,Stop Cruelty to Migrant Children Act
US,SB2135,1271652,https://legiscan.com/US/bill/SB2135/2019,https://legiscan.com/US/text/SB2135/2019,2019-07-17,Read twice and referred to the Committee on the Judiciary.,Humanitarian Standards for Individuals in Customs and Border Protection Custody Act
US,HB3865,1271787,https://legiscan.com/US/bill/HB3865/2019,https://legiscan.com/US/text/HB3865/2019,2019-07-22,Referred to the Subcommittee on Health.,Robin Danielson Feminine Hygiene Product Safety Act of 2019
US,HB3918,1271929,https://legiscan.com/US/bill/HB3918/2019,https://legiscan.com/US/text/HB3918/2019,2019-08-06,Referred to the Subcommittee on Immigration and Citizenship.,Stop Cruelty to Migrant Children Act
NY,A08529,1272726,https://legiscan.com/NY/bill/A08529/2019,https://legiscan.com/NY/text/A08529/2019,2020-01-08,referred to health,Relates to the regulation of ingredients in feminine hygiene products.
PA,SB814,1272734,https://legiscan.com/PA/bill/SB814/2019,https://legiscan.com/PA/text/SB814/2019,2019-08-07,Referred to JUDICIARY,"In general administration of correctional institutions, further providing for State recording system for application of restraints to pregnant prisoners or detainees; in county correctional institutions, further providing for county recording system for application of restraints to pregnant prisoners or detainees; and, in miscellaneous provisions, further providing for healthy birth for incarcerated women and providing for family considerations in inmate placement and visitation, for inspections by staff of correctional institutions, for access to feminine hygiene products and for training and educational programming."
NY,A08544,1273175,https://legiscan.com/NY/bill/A08544/2019,https://legiscan.com/NY/text/A08544/2019,2020-01-08,referred to consumer affairs and protection,Relates to the full disclosure of ingredients in certain products.
NJ,S4058,1273221,https://legiscan.com/NJ/bill/S4058/2018,https://legiscan.com/NJ/text/S4058/2018,2019-08-23,"Introduced in the Senate, Referred to Senate Health, Human Services and Senior Citizens Committee",Requires Commissioner of Health to establish public awareness campaign on toxic shock syndrome.
NJ,S4054,1273294,https://legiscan.com/NJ/bill/S4054/2018,https://legiscan.com/NJ/text/S4054/2018,2019-08-23,"Introduced in the Senate, Referred to Senate Health, Human Services and Senior Citizens Committee",Provides medical cannabis is not subject to State sales tax.
WI,AB381,1273479,https://legiscan.com/WI/bill/AB381/2019,https://legiscan.com/WI/text/AB381/2019,2020-04-01,Failed to pass pursuant to Senate Joint Resolution 1,Provision of menstrual products in state and local buildings and school buildings. (FE)
FL,S0234,1273977,https://legiscan.com/FL/bill/S0234/2020,https://legiscan.com/FL/text/S0234/2020,2020-03-14,Died in Education,Student Health Services
FL,H0123,1274046,https://legiscan.com/FL/bill/H0123/2020,https://legiscan.com/FL/text/H0123/2020,2020-01-13,Withdrawn prior to introduction,Feminine Hygiene Products in Public Schools
NY,A08564,1274510,https://legiscan.com/NY/bill/A08564/2019,https://legiscan.com/NY/text/A08564/2019,2020-01-08,referred to health,Relates to the creation of a research program to determine the risks posed from chemicals in personal care products or feminine hygiene products.
IL,HB3902,1275634,https://legiscan.com/IL/bill/HB3902/2019,https://legiscan.com/IL/text/HB3902/2019,2020-02-06,Public Act . . . . . . . . . 101-0629,USE OCC TX-EXEMPT AIRCRAFT PTS
NJ,S4170,1279546,https://legiscan.com/NJ/bill/S4170/2018,https://legiscan.com/NJ/text/S4170/2018,2019-11-07,"Introduced in the Senate, Referred to Senate Education Committee","""Madalyn's Law""; requires school districts to incorporate age-appropriate instruction on toxic shock syndrome and requires installation of signage in certain women's rooms to enhance public awareness of toxic shock syndrome."
NJ,A5776,1279609,https://legiscan.com/NJ/bill/A5776/2018,https://legiscan.com/NJ/text/A5776/2018,2019-11-07,"Introduced, Referred to Assembly Health and Senior Services Committee",Provides medical cannabis is not subject to State sales tax.
NJ,S4217,1280576,https://legiscan.com/NJ/bill/S4217/2018,https://legiscan.com/NJ/text/S4217/2018,2019-11-14,"Introduced in the Senate, Referred to Senate Health, Human Services and Senior Citizens Committee",Exempts sales of condoms from sales and use tax.
NJ,A5966,1282788,https://legiscan.com/NJ/bill/A5966/2018,https://legiscan.com/NJ/text/A5966/2018,2019-11-18,"Introduced, Referred to Assembly Education Committee","""Madalyn's Law""; requires school districts to incorporate age-appropriate instruction on toxic shock syndrome and requires installation of signage in certain women's rooms to enhance public awareness of toxic shock syndrome."
OK,HB2049,1283922,https://legiscan.com/OK/bill/HB2049/2020,https://legiscan.com/OK/text/HB2049/2020,2019-02-07,Referred to Appropriations and Budget Public Safety Subcommittee,"Prisons and reformatories; providing feminine hygiene products at no cost to individuals incarcerated in county jails, detention centers and prisons; effective date."
