state,bill_number,bill_id,url,text_url,last_action_date,last_action,title
WA,HB1053,1133843,https://legiscan.com/WA/bill/HB1053/2019,https://legiscan.com/WA/text/HB1053/2019,2020-01-21,"House Rules ""X"" file.",Providing a sales and use tax exemption for feminine hygiene products.
MO,HB374,1135425,https://legiscan.com/MO/bill/HB374/2019,https://legiscan.com/MO/text/HB374/2019,2019-04-23,SCS Voted Do Pass (S),Modifies provisions relating to sales tax.
NM,HB119,1135463,https://legiscan.com/NM/bill/HB119/2019,https://legiscan.com/NM/text/HB119/2019,2019-02-01,Action Postponed Indefinitely,Feminine Hygiene Product Gross Receipts
NM,SB126,1135519,https://legiscan.com/NM/bill/SB126/2019,https://legiscan.com/NM/text/SB126/2019,2019-03-13,Signed by Governor - Chapter 276 - Apr. 4,Local Gov't Primary Care Clinic Funding
TX,HB650,1137930,https://legiscan.com/TX/bill/HB650/2019,https://legiscan.com/TX/text/HB650/2019,2019-05-23,Effective on 9/1/19,Relating to inmates of the Texas Department of Criminal Justice.
NM,HB179,1137985,https://legiscan.com/NM/bill/HB179/2019,https://legiscan.com/NM/text/HB179/2019,2019-02-01,Succeeding entries: H 119,Feminine Hygiene Product Gross Receipts
NY,A00290,1139683,https://legiscan.com/NY/bill/A00290/2019,https://legiscan.com/NY/text/A00290/2019,2019-12-13,tabled,Requires feminine hygiene products to be offered for free in charter schools.
NY,A00305,1139719,https://legiscan.com/NY/bill/A00305/2019,https://legiscan.com/NY/text/A00305/2019,2020-01-08,referred to governmental operations,Requires that all female-designated bathrooms in the state of New York provide feminine hygiene products at no cost.
MS,SB2001,1141144,https://legiscan.com/MS/bill/SB2001/2019,https://legiscan.com/MS/text/SB2001/2019,2019-02-05,Died In Committee,Munchausen by proxy; constitutes child and elder abuse.
KY,HB23,1141805,https://legiscan.com/KY/bill/HB23/2019,https://legiscan.com/KY/text/HB23/2019,2019-01-10,to Appropriations & Revenue (H),AN ACT relating to an exemption of feminine hygiene products from sales and use taxation.
KY,HB85,1141843,https://legiscan.com/KY/bill/HB85/2019,https://legiscan.com/KY/text/HB85/2019,2019-01-10,to Education (H),AN ACT relating to providing free feminine hygiene products for women public postsecondary students.
WV,SB86,1142801,https://legiscan.com/WV/bill/SB86/2019,https://legiscan.com/WV/text/SB86/2019,2019-02-25,To House Education,Requiring county boards provide free feminine hygiene products in grades five to 12
NY,A00689,1143196,https://legiscan.com/NY/bill/A00689/2019,https://legiscan.com/NY/text/A00689/2019,2020-01-08,referred to health,Relates to the tampon safety and research act and its creation of a research program to determine the risks posed from potential toxins in feminine hygiene products.
NY,A00686,1143328,https://legiscan.com/NY/bill/A00686/2019,https://legiscan.com/NY/text/A00686/2019,2020-01-08,referred to ways and means,"Relates to providing feminine hygiene products at no cost to menstruating individuals in homeless shelters, including, but not limited to, sanitary napkins, tampons and panty liners."
MN,SF13,1143671,https://legiscan.com/MN/bill/SF13/2019,https://legiscan.com/MN/text/SF13/2019,2020-05-27,"Secretary of State, Filed ",Omnibus health and human services bill
OR,HB2350,1146781,https://legiscan.com/OR/bill/HB2350/2019,https://legiscan.com/OR/text/HB2350/2019,2019-06-30,In committee upon adjournment.,Relating to assistance to low-income Oregonians; declaring an emergency.
OR,HB2344,1146928,https://legiscan.com/OR/bill/HB2344/2019,https://legiscan.com/OR/text/HB2344/2019,2019-06-30,In committee upon adjournment.,Relating to health care provided through the medical assistance program.
UT,HB0113,1147280,https://legiscan.com/UT/bill/HB0113/2019,https://legiscan.com/UT/text/HB0113/2019,2019-03-14,House/ filed in House file for bills not passed,Hygiene Tax Act
NE,LB170,1147890,https://legiscan.com/NE/bill/LB170/2019,https://legiscan.com/NE/text/LB170/2019,2020-08-13,Indefinitely postponed,Provide a sales and use tax exemption for feminine hygiene products
VT,H0029,1148025,https://legiscan.com/VT/bill/H0029/2019,https://legiscan.com/VT/text/H0029/2019,2019-01-15,Read First Time and Referred to the Committee on Ways and Means,An act relating to exempting feminine hygiene products from sales tax
TX,HB755,1148223,https://legiscan.com/TX/bill/HB755/2019,https://legiscan.com/TX/text/HB755/2019,2019-02-21,Referred to Ways & Means,Relating to a sales and use tax exemption for certain feminine hygiene products.
WA,SB5147,1148809,https://legiscan.com/WA/bill/SB5147/2019,https://legiscan.com/WA/text/SB5147/2019,2020-04-03,Effective date 7/1/2020.,Providing tax relief to females by exempting feminine hygiene products from retail sales and use tax.
FL,S0332,1150692,https://legiscan.com/FL/bill/S0332/2019,https://legiscan.com/FL/text/S0332/2019,2019-04-26,"Laid on Table, companion bill(s) passed, see CS/HB 49 (Ch. 2019-65)",Incarcerated Women
WA,SB5206,1154001,https://legiscan.com/WA/bill/SB5206/2019,https://legiscan.com/WA/text/SB5206/2019,2020-01-13,"By resolution, reintroduced and retained in present status.",Providing a sales and use tax exemption for certain feminine hygiene products.
WV,HB2464,1154595,https://legiscan.com/WV/bill/HB2464/2019,https://legiscan.com/WV/text/HB2464/2019,2019-01-16,To House Education,Requiring free feminine hygiene products in grades 6 through 12
AZ,HB2153,1154955,https://legiscan.com/AZ/bill/HB2153/2019,https://legiscan.com/AZ/text/HB2153/2019,2019-04-29,Assigned to House RULES Committee,TPT; diapers; feminine hygiene; formula
WV,HB2500,1157247,https://legiscan.com/WV/bill/HB2500/2019,https://legiscan.com/WV/text/HB2500/2019,2019-01-17,To House Finance,Exempting certain hygiene products from sales tax
RI,S0049,1157602,https://legiscan.com/RI/bill/S0049/2019,https://legiscan.com/RI/text/S0049/2019,2019-06-06,Committee recommended measure be held for further study,Sales And Use Taxes - Liability And Computation
OK,HB2049,1158977,https://legiscan.com/OK/bill/HB2049/2019,https://legiscan.com/OK/text/HB2049/2019,2019-02-07,Referred to Appropriations and Budget Public Safety Subcommittee,"Prisons and reformatories; providing feminine hygiene products at no cost to individuals incarcerated in county jails, detention centers and prisons; effective date."
RI,H5151,1160225,https://legiscan.com/RI/bill/H5151/2019,https://legiscan.com/RI/text/H5151/2019,2019-07-05,Signed by Governor,Relating To Making Appropriations In Support Of Fy 2020
ME,LD286,1162104,https://legiscan.com/ME/bill/LD286/2019,https://legiscan.com/ME/text/LD286/2019,2020-03-17,CARRIED OVER to any Special Session of the 129th Legislature pursuant to Joint Order SP 788.,An Act To Provide a Sales Tax Exemption for Menstrual Products
NH,SB142,1162416,https://legiscan.com/NH/bill/SB142/2019,https://legiscan.com/NH/text/SB142/2019,2019-07-18,Signed by the Governor on 07/17/2019; Chapter 252; Effective 07/17/2019,Requiring menstrual hygiene products in school restrooms.
MD,HB133,1163076,https://legiscan.com/MD/bill/HB133/2019,https://legiscan.com/MD/text/HB133/2019,2019-01-24,Hearing 2/07 at 1:00 p.m.,Public Schools - Provision of Feminine Hygiene Products
HI,HB610,1163601,https://legiscan.com/HI/bill/HB610/2019,https://legiscan.com/HI/text/HB610/2019,2019-01-24,"Referred to HSH/HLT, FIN, referral sheet 5",Relating To General Excise Tax Exemptions.
TN,SB0060,1165308,https://legiscan.com/TN/bill/SB0060/2019,https://legiscan.com/TN/text/SB0060/2019,2019-05-01,"Assigned to General Subcommittee of Senate Finance, Ways, and Means Committee","As introduced, eliminates the sales tax on feminine hygiene products. - Amends TCA Title 67, Chapter 6."
CT,SB00338,1167349,https://legiscan.com/CT/bill/SB00338/2019,https://legiscan.com/CT/text/SB00338/2019,2019-01-23,Referred to Joint Committee on Insurance and Real Estate,"An Act Concerning Health Savings Accounts, Diapers And Feminine Hygiene Products."
TN,HB0095,1168998,https://legiscan.com/TN/bill/HB0095/2019,https://legiscan.com/TN/text/HB0095/2019,2020-06-10,"Taken off notice for cal in s/c Finance, Ways, and Means Subcommittee of Finance, Ways, and Means Committee","As introduced, eliminates the sales tax on feminine hygiene products. - Amends TCA Title 67, Chapter 6."
TN,SB0075,1169096,https://legiscan.com/TN/bill/SB0075/2019,https://legiscan.com/TN/text/SB0075/2019,2019-05-29,Comp. became Pub. Ch. 411,"As enacted, requires custodians of state correctional facilities to provide feminine hygiene products, moisturizing soap that is not lye-based, toothbrushes and toothpaste, and any other healthcare product a custodian deems appropriate to women prisoners at no charge and in an appropriate quantity. - Amends TCA Title 41."
HI,SB1398,1170306,https://legiscan.com/HI/bill/SB1398/2019,https://legiscan.com/HI/text/SB1398/2019,2019-01-28,Referred to WAM.,Relating To General Excise Tax Exemptions.
TN,HB0129,1171853,https://legiscan.com/TN/bill/HB0129/2019,https://legiscan.com/TN/text/HB0129/2019,2019-05-29,Pub. Ch. 411,"As enacted, requires custodians of state correctional facilities to provide feminine hygiene products, moisturizing soap that is not lye-based, toothbrushes and toothpaste, and any other healthcare product a custodian deems appropriate to women prisoners at no charge and in an appropriate quantity. - Amends TCA Title 41."
HI,HB1592,1172916,https://legiscan.com/HI/bill/HB1592/2019,https://legiscan.com/HI/text/HB1592/2019,2019-01-28,"Referred to FIN, referral sheet 6",Relating To General Excise Tax Exemptions.
IL,HB0922,1174625,https://legiscan.com/IL/bill/HB0922/2019,https://legiscan.com/IL/text/HB0922/2019,2020-02-18,Added Chief Co-Sponsor Rep. Natalie A. Manley,SCHCD-FEMININE HYGIENE PRODUCT
MS,HB1422,1178758,https://legiscan.com/MS/bill/HB1422/2019,https://legiscan.com/MS/text/HB1422/2019,2019-02-05,Died In Committee,"""Dignity for Incarcerated Women Act""; create."
MO,HB741,1180806,https://legiscan.com/MO/bill/HB741/2019,https://legiscan.com/MO/text/HB741/2019,2019-04-18,Referred: Ways and Means(H),Changes the laws regarding the taxation of feminine hygiene products and diapers.
MO,HB747,1181067,https://legiscan.com/MO/bill/HB747/2019,https://legiscan.com/MO/text/HB747/2019,2019-04-11,Reported Do Pass (H) - AYES: 4 NOES: 3 PRESENT: 0,"Changes the laws regarding the taxation of feminine hygiene products, diapers, and incontinence products."
NY,S03125,1187091,https://legiscan.com/NY/bill/S03125/2019,https://legiscan.com/NY/text/S03125/2019,2019-12-13,tabled,Requires feminine hygiene products to be offered for free in charter schools.
IA,SF173,1187992,https://legiscan.com/IA/bill/SF173/2019,https://legiscan.com/IA/text/SF173/2019,2019-02-04,"Subcommittee: Chapman, Jochum, and Sweeney. S.J. 216.",A bill for an act exempting the sale of feminine hygiene products and diapers from the sales tax.
NM,HB21,1191102,https://legiscan.com/NM/bill/HB21/2019,https://legiscan.com/NM/text/HB21/2019,2019-02-18,Action Postponed Indefinitely,Free Menstrual Sanitary Products In Schools
RI,H5307,1191606,https://legiscan.com/RI/bill/H5307/2019,https://legiscan.com/RI/text/H5307/2019,2019-05-08,Committee recommended measure be held for further study,Sales And Use Taxes - Liability And Computation
TN,SB1046,1193279,https://legiscan.com/TN/bill/SB1046/2019,https://legiscan.com/TN/text/SB1046/2019,2019-05-29,Comp. became Pub. Ch. 484,"As enacted, authorizes LEAs to provide free feminine hygiene products in eligible public high schools. - Amends TCA Title 49 and Title 68."
TN,HB1483,1193621,https://legiscan.com/TN/bill/HB1483/2019,https://legiscan.com/TN/text/HB1483/2019,2019-05-29,Pub. Ch. 484,"As enacted, authorizes LEAs to provide free feminine hygiene products in eligible public high schools. - Amends TCA Title 49 and Title 68."
MD,HB811,1196552,https://legiscan.com/MD/bill/HB811/2019,https://legiscan.com/MD/text/HB811/2019,2019-02-11,Hearing 2/27 at 1:00 p.m.,Sales Tax Reform Act of 2019
AZ,HB2717,1199314,https://legiscan.com/AZ/bill/HB2717/2019,https://legiscan.com/AZ/text/HB2717/2019,2019-05-08,Assigned to House RULES Committee,DOC; hygiene products; requirements; appropriation
AZ,HB2715,1199337,https://legiscan.com/AZ/bill/HB2715/2019,https://legiscan.com/AZ/text/HB2715/2019,2019-05-08,Assigned to House RULES Committee,Feminine hygiene products; public buildings
WV,SB582,1199722,https://legiscan.com/WV/bill/SB582/2019,https://legiscan.com/WV/text/SB582/2019,2019-02-12,To Finance,Exempting certain hygiene products from sales tax
OH,SB26,1200597,https://legiscan.com/OH/bill/SB26/2019,https://legiscan.com/OH/text/SB26/2019,2020-02-05,Effective 2/5/20,Permit income tax deduction for certain teacher expenses
OH,HB19,1200694,https://legiscan.com/OH/bill/HB19/2019,https://legiscan.com/OH/text/HB19/2019,2019-02-13,Refer to Committee: Ways and Means,Exempt feminine hygiene products from sales tax
TX,HB1707,1201093,https://legiscan.com/TX/bill/HB1707/2019,https://legiscan.com/TX/text/HB1707/2019,2019-05-01,Left pending in committee,Relating to a sales and use tax exemption for certain feminine hygiene products.
MI,HB4166,1201669,https://legiscan.com/MI/bill/HB4166/2019,https://legiscan.com/MI/text/HB4166/2019,2019-02-14,Bill Electronically Reproduced 02/14/2019,Use tax; exemptions; sale of feminine hygiene products; exempt. Amends sec. 4 of 1937 PA 94 (MCL 205.94).
MI,HB4165,1202079,https://legiscan.com/MI/bill/HB4165/2019,https://legiscan.com/MI/text/HB4165/2019,2019-02-14,Bill Electronically Reproduced 02/14/2019,Sales tax; exemptions; sale of feminine hygiene products; exempt. Amends sec. 4a of 1933 PA 167 (MCL 205.54a).
NM,HB548,1202448,https://legiscan.com/NM/bill/HB548/2019,https://legiscan.com/NM/text/HB548/2019,2019-03-14,Signed by Governor - Chapter 279 - Apr. 5,Appropriations & Expenditures
KY,HB344,1202479,https://legiscan.com/KY/bill/HB344/2019,https://legiscan.com/KY/text/HB344/2019,2019-02-14,to Judiciary (H),AN ACT relating to providing free feminine hygiene products for women inmates.
IL,HB2656,1203596,https://legiscan.com/IL/bill/HB2656/2019,https://legiscan.com/IL/text/HB2656/2019,2019-07-03,Senate Floor Amendment No. 1 Pursuant to Senate Rule 3-9(b) / Referred to Assignments,HOMELESS-MENSTRUAL PRODUCTS
OH,HB75,1203850,https://legiscan.com/OH/bill/HB75/2019,https://legiscan.com/OH/text/HB75/2019,2020-12-22,Passed - Amended,Require resolution/notice if government contests property value
NV,AB144,1204678,https://legiscan.com/NV/bill/AB144/2019,https://legiscan.com/NV/text/AB144/2019,2019-04-13,"(Pursuant to Joint Standing Rule No. 14.3.1, no further action allowed.)",Proposes to exempt sales of diapers from sales and use taxes and analogous taxes upon approval by the voters. (BDR 32-275)
IL,HB3212,1206295,https://legiscan.com/IL/bill/HB3212/2019,https://legiscan.com/IL/text/HB3212/2019,2019-03-29,Rule 19(a) / Re-referred to Rules Committee,IL FIRST STEP
LA,SB5,1208460,https://legiscan.com/LA/bill/SB5/2019,https://legiscan.com/LA/text/SB5/2019,2019-06-05,Notice House Conference Committee members appointed.,"Exempts diapers and feminine hygiene products from sales and use tax. (1/1/21) (RRF -$14,500,000 GF RV See Note)"
LA,SB4,1208628,https://legiscan.com/LA/bill/SB4/2019,https://legiscan.com/LA/text/SB4/2019,2019-05-09,"Reconsidered. Read by title; returned to the Calendar, subject to call.",Constitutional amendment to exempt diapers and feminine hygiene products from state sales and use tax. (2/3 - CA13s1(A)) (RE DECREASE GF RV See Note)
IA,SF311,1210587,https://legiscan.com/IA/bill/SF311/2019,https://legiscan.com/IA/text/SF311/2019,2019-02-21,"Subcommittee: Sinclair, Cournoyer, and Wahls. S.J. 380.",A bill for an act providing for access to feminine hygiene products in public school restrooms.
RI,S0264,1211264,https://legiscan.com/RI/bill/S0264/2019,https://legiscan.com/RI/text/S0264/2019,2019-04-24,Committee recommended measure be held for further study,Health And Safety Of Pupils
IA,HF462,1211402,https://legiscan.com/IA/bill/HF462/2019,https://legiscan.com/IA/text/HF462/2019,2020-01-22,"Subcommittee reassigned: Hagenow, Hein and Jacoby. H.J. 122.",A bill for an act exempting the sale of feminine hygiene products from the sales tax.
TX,HB2169,1213030,https://legiscan.com/TX/bill/HB2169/2019,https://legiscan.com/TX/text/HB2169/2019,2019-06-14,Effective on 9/1/19,Relating to reporting concerning female prisoners who are confined in county jails and to the provision of feminine hygiene products to female prisoners.
CA,AB1672,1215751,https://legiscan.com/CA/bill/AB1672/2019,https://legiscan.com/CA/text/AB1672/2019,2020-08-20,In committee: Held under submission.,Solid waste: premoistened nonwoven disposable wipes.
GA,HB475,1217149,https://legiscan.com/GA/bill/HB475/2019,https://legiscan.com/GA/text/HB475/2019,2019-02-27,House Second Readers,"Penal institutions; provide matters related to the housing, health, and care of female inmates"
MI,SB0123,1217609,https://legiscan.com/MI/bill/SB0123/2019,https://legiscan.com/MI/text/SB0123/2019,2019-02-26,Referred To Committee On Finance,Sales tax; exemptions; sale of feminine hygiene products; exempt. Amends sec. 4a of 1933 PA 167 (MCL 205.54a).
MO,SB443,1217733,https://legiscan.com/MO/bill/SB443/2019,https://legiscan.com/MO/text/SB443/2019,2019-03-07,Second Read and Referred S Ways and Means Committee,Imposes a reduced sales tax rate on certain products
MI,SB0124,1217801,https://legiscan.com/MI/bill/SB0124/2019,https://legiscan.com/MI/text/SB0124/2019,2019-02-26,Referred To Committee On Finance,Use tax; exemptions; sale of feminine hygiene products; exempt. Amends sec. 4 of 1937 PA 94 (MCL 205.94).
MA,H1486,1218692,https://legiscan.com/MA/bill/H1486/2019,https://legiscan.com/MA/text/H1486/2019,2020-11-12,"Accompanied a study order, see H5081",To reduce recidivism among emerging adults
MA,H565,1218693,https://legiscan.com/MA/bill/H565/2019,https://legiscan.com/MA/text/H565/2019,2020-01-15,"Accompanied a new draft, see H4293",Concerning feminine hygiene products in schools
MN,HF1914,1225624,https://legiscan.com/MN/bill/HF1914/2019,https://legiscan.com/MN/text/HF1914/2019,2020-04-30,Second reading,"Advanced practice registered nurses added to certain statutes, and medical assistance coverage expanded to orthotic devices."
MA,S940,1225923,https://legiscan.com/MA/bill/S940/2019,https://legiscan.com/MA/text/S940/2019,2020-02-03,"Accompanied a study order, see S2496",To reduce recidivism among emerging adults
MN,SF1966,1227816,https://legiscan.com/MN/bill/SF1966/2019,https://legiscan.com/MN/text/SF1966/2019,2020-02-27,Second reading,Advanced practice registered nurses provisions modifications
MN,HF2060,1229064,https://legiscan.com/MN/bill/HF2060/2019,https://legiscan.com/MN/text/HF2060/2019,2019-03-07,Author added Moran as Chief Author,"Housing, health care, chemical and mental health, older adults continuing care, operations, direct care and treatment, child and family services, and disability services policy provisions modified."
US,SB661,1230934,https://legiscan.com/US/bill/SB661/2019,https://legiscan.com/US/text/SB661/2019,2019-03-05,Read twice and referred to the Committee on the Judiciary.,Child Trafficking Victims Protection and Welfare Act of 2019
OH,SB95,1233359,https://legiscan.com/OH/bill/SB95/2019,https://legiscan.com/OH/text/SB95/2019,2020-12-17,Informally passed,Enhance tax inducements for fixed asset and employment investment
MN,HF2185,1233572,https://legiscan.com/MN/bill/HF2185/2019,https://legiscan.com/MN/text/HF2185/2019,2019-03-18,Second reading,Disability services policy provisions modified.
MN,SF2247,1235338,https://legiscan.com/MN/bill/SF2247/2019,https://legiscan.com/MN/text/SF2247/2019,2019-03-11,Referred to Human Services Reform Finance and Policy,Human services disability services policy provisions modifications
MI,HR0039,1237447,https://legiscan.com/MI/bill/HR0039/2019,https://legiscan.com/MI/text/HR0039/2019,2019-03-12,Referred To Committee On Health Policy,A resolution to memorialize the Congress of the United States to amend the Internal Revenue Code to allow feminine-hygiene products to qualify as an eligible expense under flexible spending accounts.
MN,SF2570,1240236,https://legiscan.com/MN/bill/SF2570/2019,https://legiscan.com/MN/text/SF2570/2019,2019-03-21,Author added Hoffman,Omnibus health and human services policy bill
GA,HR647,1243663,https://legiscan.com/GA/bill/HR647/2019,https://legiscan.com/GA/text/HR647/2019,2019-03-26,House Second Readers,"House Study Committee on Addressing Period (or Menstruation) Poverty in Girls in Elementary, Middle, and High Schools in Need in Georgia; create"
DC,B23-0209,1243831,https://legiscan.com/DC/bill/B23-0209/2019,https://legiscan.com/DC/text/B23-0209/2019,2020-02-11,Committee Report Filed,Fiscal Year 2020 Budget Support Act of 2019
PA,HB1008,1245719,https://legiscan.com/PA/bill/HB1008/2019,https://legiscan.com/PA/text/HB1008/2019,2019-04-02,Referred to JUDICIARY,"In miscellaneous provisions relating to inmate confinement, providing for feminine hygiene products."
GA,HB714,1246503,https://legiscan.com/GA/bill/HB714/2019,https://legiscan.com/GA/text/HB714/2019,2019-04-02,House Second Readers,Penal institutions; punishment; revise provisions
AL,HB308,1248011,https://legiscan.com/AL/bill/HB308/2019,https://legiscan.com/AL/text/HB308/2019,2019-05-23,"Delivered to Governor at 9:45 a.m. on May 23, 2019.","County jails and state penitentiaries, prisoners, sheriff and Dept. of Corrections, required to provide feminine hygiene products to female inmates, Secs. 14-3-44, 14-6-19 am'd."
OH,HB197,1251489,https://legiscan.com/OH/bill/HB197/2019,https://legiscan.com/OH/text/HB197/2019,2020-03-27,Effective 3/27/20,Make technical and corrective changes to tax law
PA,HB1231,1252532,https://legiscan.com/PA/bill/HB1231/2019,https://legiscan.com/PA/text/HB1231/2019,2019-04-17,Referred to FINANCE,"Providing for tax levies and information related to taxes; authorizing the imposition of a personal income tax or an earned income tax by a school district subject to voter approval; providing for education tax and for imposition of and exclusions from a sales and use tax for the elimination of residential property taxes; establishing the Public Transportation Reserve Fund; providing for increase to the personal income tax, for certain licenses, for hotel occupancy tax, for procedure and administration of the tax, for expiration of authority to issue certain debt and for reporting by local government units of debt outstanding; establishing the Residential Property Tax Elimination Fund; providing for disbursements from this fund and for certain rebates and assistance to senior citizens; and repealing sales tax provisions of the Tax Reform Code of 1971 and earned income tax of the Taxpayer Relief Act."
NC,H988,1254499,https://legiscan.com/NC/bill/H988/2019,https://legiscan.com/NC/text/H988/2019,2019-04-26,"Ref to the Com on Appropriations, Justice and Public Safety, if favorable, Rules, Calendar, and Operations of the House",Next Step Act
MN,HF2861,1254861,https://legiscan.com/MN/bill/HF2861/2019,https://legiscan.com/MN/text/HF2861/2019,2019-05-02,Author added Lucero,Income and business taxes eliminated and sales tax replaced with a fair tax.
NJ,S3645,1260448,https://legiscan.com/NJ/bill/S3645/2018,https://legiscan.com/NJ/text/S3645/2018,2019-06-17,Referred to Senate Budget and Appropriations Committee,Requires school districts to provide feminine hygiene products in certain public schools and requires State to pay costs.
NY,S06088,1261945,https://legiscan.com/NY/bill/S06088/2019,https://legiscan.com/NY/text/S06088/2019,2020-01-08,"REFERRED TO CRIME VICTIMS, CRIME AND CORRECTION",Relates to replacing all instances of the words or variations of the words inmate or inmates with the words incarcerated individual or incarcerated individuals or variation thereof.
AL,SR83,1263501,https://legiscan.com/AL/bill/SR83/2019,https://legiscan.com/AL/text/SR83/2019,2019-05-21,Waggoner motion to Adopt adopted Roll Call 912,"Senate, Special Order Calendar"
NY,A07866,1264696,https://legiscan.com/NY/bill/A07866/2019,https://legiscan.com/NY/text/A07866/2019,2020-01-08,referred to correction,Relates to replacing all instances of the words or variations of the words inmate or inmates with the words incarcerated individual or incarcerated individuals or variation thereof.
OR,HB3446,1266283,https://legiscan.com/OR/bill/HB3446/2019,https://legiscan.com/OR/text/HB3446/2019,2019-06-30,In committee upon adjournment.,Relating to the exemption of certain receipts from the corporate activity tax; prescribing an effective date.
MI,HR0113,1266410,https://legiscan.com/MI/bill/HR0113/2019,https://legiscan.com/MI/text/HR0113/2019,2019-06-04,Adopted,"A resolution to declare May 28, 2019, as Menstrual Hygiene Day in the state of Michigan."
US,HB3239,1268169,https://legiscan.com/US/bill/HB3239/2019,https://legiscan.com/US/text/HB3239/2019,2019-07-25,Received in the Senate and Read twice and referred to the Committee on the Judiciary.,Humanitarian Standards for Individuals in Customs and Border Protection Custody Act
DC,B23-0352,1269946,https://legiscan.com/DC/bill/B23-0352/2019,https://legiscan.com/DC/text/B23-0352/2019,2019-07-26,"Act A23-0091 Published in DC Register Vol 66 and Page 8497, Expires on Oct 20, 2019",Fiscal Year 2020 Budget Support Emergency Act of 2019
US,HB3524,1270660,https://legiscan.com/US/bill/HB3524/2019,https://legiscan.com/US/text/HB3524/2019,2019-08-02,"Referred to the Subcommittee on Border Security, Facilitation, and Operations.",Northern Triangle and Border Stabilization Act
DC,B23-0367,1270878,https://legiscan.com/DC/bill/B23-0367/2019,https://legiscan.com/DC/text/B23-0367/2019,2019-09-13,"Act A23-0112 Published in DC Register Vol 66 and Page 11964, Expires on Dec 02, 2019",Fiscal Year 2020 Budget Support Congressional Review Emergency Act of 2019
