state,bill_number,bill_id,url,text_url,last_action_date,last_action,title
NJ,A5671,1508734,https://legiscan.com/NJ/bill/A5671/2020,https://legiscan.com/NJ/text/A5671/2020,2021-05-12,"Introduced, Referred to Assembly Women and Children Committee",Requires DHS to establish a pilot program covering menstrual hygiene products under Medicaid and NJ FamilyCare.
NY,A07777,1511360,https://legiscan.com/NY/bill/A07777/2021,https://legiscan.com/NY/text/A07777/2021,2022-05-10,reported referred to ways and means,"Provides an additional monthly public assistance allowance of $10 for menstrual products, including but not limited to, tampons, sanitary napkins, cups and panty liners."
TX,HR1898,1513265,https://legiscan.com/TX/bill/HR1898/2021,https://legiscan.com/TX/text/HR1898/2021,2021-06-03,Reported enrolled,Commending the Skyline High School IGNITE club for its campaign to make feminine hygiene products available at Dallas ISD schools.
US,HB3614,1513368,https://legiscan.com/US/bill/HB3614/2021,https://legiscan.com/US/text/HB3614/2021,2022-11-01,"Referred to the Subcommittee on Crime, Terrorism, and Homeland Security.",Menstrual Equity For All Act of 2021
US,HB3560,1513380,https://legiscan.com/US/bill/HB3560/2021,https://legiscan.com/US/text/HB3560/2021,2021-05-28,Referred to the House Committee on Education and Labor.,Homeless Youth Menstrual Product Access Act of 2021
NJ,SCR154,1513896,https://legiscan.com/NJ/bill/SCR154/2020,https://legiscan.com/NJ/text/SCR154/2020,2021-06-01,"Introduced in the Senate, Referred to Senate Health, Human Services and Senior Citizens Committee",Declares May 28 of each year as Menstrual Equity Day in New Jersey.
MA,S2465,1514301,https://legiscan.com/MA/bill/S2465/2021,https://legiscan.com/MA/text/S2465/2021,2021-05-27,See H4001,Site Information & Links
US,HB3764,1515157,https://legiscan.com/US/bill/HB3764/2021,https://legiscan.com/US/text/HB3764/2021,2022-12-30,"Placed on the Union Calendar, Calendar No. 511.",Ocean-Based Climate Solutions Act of 2022
NJ,A5846,1515351,https://legiscan.com/NJ/bill/A5846/2020,https://legiscan.com/NJ/text/A5846/2020,2021-06-09,"Introduced, Referred to Assembly Aging and Senior Services Committee",Exempts medical alert devices and services from sales and use tax.
MN,HF33,1516035,https://legiscan.com/MN/bill/HF33/2021/X1,https://legiscan.com/MN/text/HF33/2021/X1,2021-06-29,Secretary of State Chapter 7 ,Omnibus health and human services bill.
AZ,HB2911,1516087,https://legiscan.com/AZ/bill/HB2911/2021,https://legiscan.com/AZ/text/HB2911/2021,2021-06-25,House miscellaneous motion: Rep. Toma moved that rules be suspended and House Bill 2911 be immediately placed under the order of business Third Reading of bills for the purpose of substitution of bills on Third Reading,Prisoners; training; individual certificates
AZ,SB1849,1516423,https://legiscan.com/AZ/bill/SB1849/2021,https://legiscan.com/AZ/text/SB1849/2021,2021-06-30,Chapter 400,Prisoners; training; individual certificates.
NJ,S3927,1516465,https://legiscan.com/NJ/bill/S3927/2020,https://legiscan.com/NJ/text/S3927/2020,2021-06-15,"Introduced in the Senate, Referred to Senate Budget and Appropriations Committee",Exempts medical alert devices and services from sales and use tax.
NJ,AJR235,1516639,https://legiscan.com/NJ/bill/AJR235/2020,https://legiscan.com/NJ/text/AJR235/2020,2021-06-16,"Introduced, Referred to Assembly Women and Children Committee","Establishes the last full week of May as ""Period Poverty Awareness Week."""
US,HB3975,1516801,https://legiscan.com/US/bill/HB3975/2021,https://legiscan.com/US/text/HB3975/2021,2021-06-17,Referred to the Subcommittee on Trade.,Generalized System of Preferences and Miscellaneous Tariff Bill Modernization Act of 2021
NJ,A5922,1517000,https://legiscan.com/NJ/bill/A5922/2020,https://legiscan.com/NJ/text/A5922/2020,2021-06-21,"Introduced, Referred to Assembly Environment and Solid Waste Committee","Establishes ""Menstrual Hygiene Product Pilot Program,"" appropriates $60,000."
NJ,A5923,1517047,https://legiscan.com/NJ/bill/A5923/2020,https://legiscan.com/NJ/text/A5923/2020,2021-06-21,"Introduced, Referred to Assembly Environment and Solid Waste Committee","Establishes ""Menstrual Hygiene Products Program,"" appropriates $200,000."
US,HB4037,1517204,https://legiscan.com/US/bill/HB4037/2021,https://legiscan.com/US/text/HB4037/2021,2021-06-22,Referred to the Subcommittee on Trade.,Trade Preferences and American Manufacturing Competitiveness Act of 2021
US,HB4350,1518444,https://legiscan.com/US/bill/HB4350/2021,https://legiscan.com/US/text/HB4350/2021,2022-03-01,Returned to the Calendar. Calendar No. 144.,Secure And Fair Enforcement Banking Act of 2021 Saudi Arabia Accountability for Gross Violations of Human Rights Act COVID19 Emergency Medical Supplies Enhancement Act of 2021 IRC implementation Act of 2021 District of Columbia National Guard Home Rule Act Central American Women and Children Protection Act of 2021 Preventing Sexual Harassment in Public Housing Act of 2021 Global Pandemic Prevention and Biosecurity Act Barry Goldwater Scholarship and Excellence in Education Modernization Act of 2021 Public Diplomacy Modernization Act of 2021
MA,H4002,1518928,https://legiscan.com/MA/bill/H4002/2021,https://legiscan.com/MA/text/H4002/2021,2021-07-29,Section 121 passed over veto -see  Roll Call #70 (Yeas 39 to Nays 1),"Making appropriations for the fiscal year 2022 for the maintenance of the departments, boards, commissions, institutions and certain activities of the Commonwealth, for interest, sinking fund and serial bond requirements and for certain permanent improvements"
US,HB4521,1519516,https://legiscan.com/US/bill/HB4521/2021,https://legiscan.com/US/text/HB4521/2021,2022-05-05,Message on Senate action sent to the House.,"United States Innovation and Competition Act of 2021 Cyber Response and Recovery   Act Federal Rotational Cyber   Workforce Program Act of 2021 Facilitating Federal Employee   Reskilling Act Meeting the   China Challenge Act of 2021 Trade Act of 2021 Merger Filing Fee Modernization Act of 2021 Safeguarding American Innovation Act National Risk Management Act of 2021 No TikTok on Government Devices Act American Security Drone Act of 2021 Make PPE in America Act National Aeronautics and Space   Administration Authorization Act of 2021 Strategic   Competition Act of 2021 Countering Chinese Communist   Party Malign Influence Act Build America, Buy America   Act Space Preservation and   Conjunction Emergency Act of 2021 Taiwan Fellowship Act BuyAmerican.gov Act of 2021 Advancing American AI Act Promoting   United States International Leadership in 5G Act of 2021 Securing   America's Future Act Aeronautics Innovation Act National   Strategy to Ensure American Leadership Act of 2021 Improving Minority Participation And Careers in Telecommunications Act Bioeconomy   Research and Development Act of 2021 Sister City   Transparency Act Shark Fin   Sales Elimination Act of 2021 Combating   Sexual Harassment in Science Act of 2021 Supporting   Early-Career Researchers Act Advancing IoT   for Precision Agriculture Act of 2021 Endless   Frontier Act"
US,HB4602,1519741,https://legiscan.com/US/bill/HB4602/2021,https://legiscan.com/US/text/HB4602/2021,2021-07-22,Referred to the Subcommittee on Consumer Protection and Commerce.,WIPPES Act Wastewater Infrastructure Pollution Prevention and Environmental Safety Act
DE,SB198,1520816,https://legiscan.com/DE/bill/SB198/2021,https://legiscan.com/DE/text/SB198/2021,2022-02-07,Signed by Governor,"An Act To Amend Titles 10, 11, 13, 14, 16, 29, And 31 Of The Delaware Code Relating To The Office Of Child Care Licensing."
US,SB2645,1520973,https://legiscan.com/US/bill/SB2645/2021,https://legiscan.com/US/text/SB2645/2021,2021-08-05,Read twice and referred to the Committee on Finance.,Rewarding Efforts to Decrease Unrecycled Contaminants in Ecosystems Act of 2021 REDUCE Act of 2021
MI,HB5267,1521782,https://legiscan.com/MI/bill/HB5267/2021,https://legiscan.com/MI/text/HB5267/2021,2021-11-09,Assigned Pa 108'21 With Immediate Effect,Sales tax: exemptions; sale of feminine hygiene products; exempt. Amends secs. 4a & 25 of 1933 PA 167 (MCL 205.54a & 205.75).
NY,A08264,1522199,https://legiscan.com/NY/bill/A08264/2021,https://legiscan.com/NY/text/A08264/2021,2022-03-31,advanced to third reading cal.513,"Replaces all instances of the words or variations of the words feminine hygiene products and sanitary napkins with the words menstrual products or pads, respectively, or a variation thereof."
AK,HB3006,1522560,https://legiscan.com/AK/bill/HB3006/2021,https://legiscan.com/AK/text/HB3006/2021,2021-08-31,COSPONSOR(S): DRUMMOND,State Sales And Use Tax
OH,SB221,1522816,https://legiscan.com/OH/bill/SB221/2021,https://legiscan.com/OH/text/SB221/2021,2021-09-08,Refer to Committee: Ways and Means,Expand products eligible for sales tax holiday
OH,SB222,1522849,https://legiscan.com/OH/bill/SB222/2021,https://legiscan.com/OH/text/SB222/2021,2021-09-08,Refer to Committee: Ways and Means,Provide sales tax holiday in March for Energy Star products
FL,S0248,1523668,https://legiscan.com/FL/bill/S0248/2022,https://legiscan.com/FL/text/S0248/2022,2022-03-14,Died in Education,Student Health Services
IL,HB4148,1523678,https://legiscan.com/IL/bill/HB4148/2021,https://legiscan.com/IL/text/HB4148/2021,2022-04-11,Rule 19(a) / Re-referred to Rules Committee,DNR-PARKS/MENSTRUAL PRODUCTS
PA,HB1419,1523830,https://legiscan.com/PA/bill/HB1419/2021,https://legiscan.com/PA/text/HB1419/2021,2022-09-19,Referred to JUDICIARY,"In general administration, further providing for State recording system for application of restraints to pregnant prisoners or detainees; in county correctional institutions, further providing for county recording system for application of restraints to pregnant prisoners or detainees; and, in miscellaneous provisions, further providing for healthy birth for incarcerated women and providing for restrictive housing prohibited for pregnant or postpartum incarcerated individuals and detainees, for cavity search and inspection restrictions, for training and education requirement, for family consideration in placement and visitation, for feminine hygiene and incontinence products and for postpartum recovery."
FL,H0175,1524051,https://legiscan.com/FL/bill/H0175/2022,https://legiscan.com/FL/text/H0175/2022,2022-03-14,Died in Secondary Education & Career Development Subcommittee,Menstrual Hygiene Products in Public Schools
OH,SB235,1524133,https://legiscan.com/OH/bill/SB235/2021,https://legiscan.com/OH/text/SB235/2021,2022-12-14,Reported - Substitute: Ways and Means,Exempt certain fees and service charges from sales and use tax
US,HB5389,1524541,https://legiscan.com/US/bill/HB5389/2021,https://legiscan.com/US/text/HB5389/2021,2021-09-28,Referred to the Subcommittee on Environment and Climate Change.,REDUCE Act of 2021 Rewarding Efforts to Decrease Unrecycled Contaminants in Ecosystems Act of 2021
OH,HB436,1524591,https://legiscan.com/OH/bill/HB436/2021,https://legiscan.com/OH/text/HB436/2021,2021-10-12,Refer to Committee: Ways and Means,Regards port authority contracts and bond authority
PA,HB1954,1525222,https://legiscan.com/PA/bill/HB1954/2021,https://legiscan.com/PA/text/HB1954/2021,2021-10-05,Referred to EDUCATION,"In school health services, providing for menstrual hygiene products."
AK,HB4005,1525314,https://legiscan.com/AK/bill/HB4005/2021,https://legiscan.com/AK/text/HB4005/2021,2021-10-04,REFERRED TO WAYS & MEANS,State Sales And Use Tax
IL,HB4178,1526657,https://legiscan.com/IL/bill/HB4178/2021,https://legiscan.com/IL/text/HB4178/2021,2022-02-17,Added Co-Sponsor Rep. Katie Stuart,SCH CD-MENSTRUAL PRODUCTS
IL,HB4183,1526841,https://legiscan.com/IL/bill/HB4183/2021,https://legiscan.com/IL/text/HB4183/2021,2022-04-11,Rule 19(a) / Re-referred to Rules Committee,REST AREA-MENSTRUAL PRODUCTS
WI,AB680,1528438,https://legiscan.com/WI/bill/AB680/2021,https://legiscan.com/WI/text/AB680/2021,2022-03-15,Failed to pass pursuant to Senate Joint Resolution 1,"Sales and use tax exemption for diapers, undergarments for incontinence, tampons, and sanitary napkins. (FE)"
OH,HB471,1528574,https://legiscan.com/OH/bill/HB471/2021,https://legiscan.com/OH/text/HB471/2021,2021-11-02,Refer to Committee: Ways and Means,"Exempt sale of certain firearms, ammo from sales and use taxes"
FL,H0485,1532061,https://legiscan.com/FL/bill/H0485/2022,https://legiscan.com/FL/text/H0485/2022,2022-03-14,Died in Criminal Justice & Public Safety Subcommittee,Treatment of Inmates
MA,S2577,1532933,https://legiscan.com/MA/bill/S2577/2021,https://legiscan.com/MA/text/S2577/2021,2022-02-14,"Accompanied a study order, see S2692",To ban single use plastic applicators
IL,HB4218,1533528,https://legiscan.com/IL/bill/HB4218/2021,https://legiscan.com/IL/text/HB4218/2021,2022-12-21,Public Act . . . . . . . . . 102-1111,CD CORR-MENSTRUAL HYGIENE PROD
NJ,A6053,1533534,https://legiscan.com/NJ/bill/A6053/2020,https://legiscan.com/NJ/text/A6053/2020,2021-11-15,"Introduced, Referred to Assembly Health Committee",Establishes requirements for State entities to enter into bulk purchasing arrangements for menstrual products.
NJ,A6052,1533611,https://legiscan.com/NJ/bill/A6052/2020,https://legiscan.com/NJ/text/A6052/2020,2021-11-15,"Introduced, Referred to Assembly Education Committee",Requires certain public schools to advertise availability of free menstrual hygiene products.
OH,SB265,1533685,https://legiscan.com/OH/bill/SB265/2021,https://legiscan.com/OH/text/SB265/2021,2021-11-30,Refer to Committee: Ways and Means,"Exempt sale of certain firearms, ammunition from sales, use tax"
GA,SR57,1534569,https://legiscan.com/GA/bill/SR57/2021/X1,https://legiscan.com/GA/text/SR57/2021/X1,2021-11-19,Senate Read and Adopted,"Harbison, Dr. Kamesha; recognize"
GA,HB861,1534837,https://legiscan.com/GA/bill/HB861/2021,https://legiscan.com/GA/text/HB861/2021,2022-01-26,House Second Readers,"Health; increase access to disposable menstrual products in public schools, penal institutions, certain social service shelters, and housing facilities"
GA,HB864,1534840,https://legiscan.com/GA/bill/HB864/2021,https://legiscan.com/GA/text/HB864/2021,2022-01-26,House Second Readers,Public assistance; use certain benefits for purchasing diapers or menstrual products; provide for waiver request
GA,HB863,1534844,https://legiscan.com/GA/bill/HB863/2021,https://legiscan.com/GA/text/HB863/2021,2022-01-26,House Second Readers,University System of Georgia; menstrual hygiene products available at no cost to students in certain facilities; require
IL,HB4234,1535036,https://legiscan.com/IL/bill/HB4234/2021,https://legiscan.com/IL/text/HB4234/2021,2022-04-04,Added Co-Sponsor Rep. Joyce Mason,USE/OCC TX-BREAST PUMPS
MO,HB1679,1535761,https://legiscan.com/MO/bill/HB1679/2022,https://legiscan.com/MO/text/HB1679/2022,2022-04-07,Referred: Rules - Administrative Oversight(H),Reduces the tax on diapers and feminine hygiene products
MO,SB897,1536338,https://legiscan.com/MO/bill/SB897/2022,https://legiscan.com/MO/text/SB897/2022,2022-01-27,Second Read and Referred S Ways and Means Committee,Authorizes a sales tax exemption for feminine hygiene products
OH,HB498,1536450,https://legiscan.com/OH/bill/HB498/2021,https://legiscan.com/OH/text/HB498/2021,2021-12-07,Refer to Committee: Finance,Enact the Ohio Adult Use Act; levy a tax
MO,HB1843,1537029,https://legiscan.com/MO/bill/HB1843/2022,https://legiscan.com/MO/text/HB1843/2022,2022-05-13,Referred: Elementary and Secondary Education(H),"Requires school districts to provide ""period products"" at no cost in charter schools and public middle and high schools"
MO,HB1842,1537094,https://legiscan.com/MO/bill/HB1842/2022,https://legiscan.com/MO/text/HB1842/2022,2022-05-13,Referred: Elementary and Secondary Education(H),"Requires school districts to provide ""period products"" at no cost in middle schools and high schools and charter schools"
MI,HB5612,1537420,https://legiscan.com/MI/bill/HB5612/2021,https://legiscan.com/MI/text/HB5612/2021,2022-03-15,Defeated Roll Call # 120 Yeas 50 Nays 53 Excused 0 Not Voting 3,Sales tax: exemptions; sale of incontinence products; exempt. Amends secs. 4a & 25 of 1933 PA 167 (MCL 205.54a & 205.75).
MI,HB5611,1537468,https://legiscan.com/MI/bill/HB5611/2021,https://legiscan.com/MI/text/HB5611/2021,2022-03-15,Roll Call Roll Call # 119 Yeas 49 Nays 54 Excused 0 Not Voting 3,Use tax: exemptions; sale of incontinence products; exempt. Amends secs. 4 & 21 of 1937 PA 94 (MCL 205.94 & 205.111).
MI,HB5636,1538486,https://legiscan.com/MI/bill/HB5636/2021,https://legiscan.com/MI/text/HB5636/2021,2021-12-15,Bill Electronically Reproduced 12/14/2021,School aid: other; funding for menstrual hygiene products in schools; provide for. Amends sec. 11 of 1979 PA 94 (MCL 388.1611) & adds sec. 99cc.
HI,HB638,1539075,https://legiscan.com/HI/bill/HB638/2022,https://legiscan.com/HI/text/HB638/2022,2021-12-10,Carried over to 2022 Regular Session.,Relating To General Excise Tax Exemptions.
HI,SB849,1540617,https://legiscan.com/HI/bill/SB849/2022,https://legiscan.com/HI/text/SB849/2022,2021-12-10,Carried over to 2022 Regular Session.,Relating To General Excise Tax Exemptions.
HI,SB966,1540666,https://legiscan.com/HI/bill/SB966/2022,https://legiscan.com/HI/text/SB966/2022,2021-12-10,Carried over to 2022 Regular Session.,Relating To Menstrual Equity.
MO,HB1971,1541409,https://legiscan.com/MO/bill/HB1971/2022,https://legiscan.com/MO/text/HB1971/2022,2022-05-13,Referred: Ways and Means(H),Changes the laws regarding the taxation of feminine hygiene products and diapers
MD,HB3,1542299,https://legiscan.com/MD/bill/HB3/2022,https://legiscan.com/MD/text/HB3/2022,2022-02-14,Withdrawn by Sponsor,Sales and Use Tax - Diapers - Exemption
KS,HB2461,1543863,https://legiscan.com/KS/bill/HB2461/2021,https://legiscan.com/KS/text/HB2461/2021,2022-05-23,House Died in Committee,Providing for sales tax exemption for hygiene products.
DC,PR24-0529,1544285,https://legiscan.com/DC/bill/PR24-0529/2021,https://legiscan.com/DC/text/PR24-0529/2021,2022-01-14,"Resolution R24-0356, Effective from Jan 04, 2022 Published in DC Register Page 000250",Expanding Student Access to Period Products Emergency Declaration Resolution of 2022
DC,B24-0583,1544316,https://legiscan.com/DC/bill/B24-0583/2021,https://legiscan.com/DC/text/B24-0583/2021,2022-01-04,Agendized; not considered at the request of WITHDRAWN,Expanding Student Access to Period Products Temporary Act of 2022
DC,B24-0582,1544346,https://legiscan.com/DC/bill/B24-0582/2021,https://legiscan.com/DC/text/B24-0582/2021,2022-01-28,"Act A24-0302 Published in DC Register Vol 69 and Page 000620, Expires on Apr 24, 2022",Expanding Student Access to Period Products Emergency Act of 2022
MS,HB311,1544735,https://legiscan.com/MS/bill/HB311/2022,https://legiscan.com/MS/text/HB311/2022,2022-02-23,Died In Committee,"Sales tax; exempt certain retail sales of electronic devices/educational software, sales of feminine hygiene products."
KY,HB27,1545593,https://legiscan.com/KY/bill/HB27/2022,https://legiscan.com/KY/text/HB27/2022,2022-01-04,to Committee on Committees (H),AN ACT relating to the taxation of feminine hygiene products.
IN,SB0169,1545692,https://legiscan.com/IN/bill/SB0169/2022,https://legiscan.com/IN/text/SB0169/2022,2022-01-06,First reading: referred to Committee on Tax and Fiscal Policy,Sales tax exemption for certain hygiene products.
MO,HB2241,1545989,https://legiscan.com/MO/bill/HB2241/2022,https://legiscan.com/MO/text/HB2241/2022,2022-05-13,Referred: Ways and Means(H),Changes the laws regarding the taxation of feminine hygiene products and diapers
MO,HB2257,1546035,https://legiscan.com/MO/bill/HB2257/2022,https://legiscan.com/MO/text/HB2257/2022,2022-05-13,Referred: Ways and Means(H),Changes the laws regarding the taxation of feminine hygiene products and diapers
MO,HB2272,1546511,https://legiscan.com/MO/bill/HB2272/2022,https://legiscan.com/MO/text/HB2272/2022,2022-04-07,HCS Reported Do Pass (H) - AYES: 5 NOES: 1 PRESENT: 1,Changes the laws regarding the taxation of feminine hygiene products and diapers
NM,HB32,1546518,https://legiscan.com/NM/bill/HB32/2022,https://legiscan.com/NM/text/HB32/2022,2022-01-25,Action Postponed Indefinitely,Feminine Hygiene Product Gross Receipts
AL,HB50,1547045,https://legiscan.com/AL/bill/HB50/2022,https://legiscan.com/AL/text/HB50/2022,2022-04-06,"Delivered to Governor at 1:53 p.m. on April 6, 2022.","Schools, K-12, local boards of education required to provide feminine hygiene products in women's restrooms of certain schools, no cost to students"
WA,HB1816,1547215,https://legiscan.com/WA/bill/HB1816/2021,https://legiscan.com/WA/text/HB1816/2021,2022-02-24,Referred to Rules 2 Review.,Making 2021-2023 fiscal biennium supplemental operating appropriations.
RI,H6634,1547452,https://legiscan.com/RI/bill/H6634/2022,https://legiscan.com/RI/text/H6634/2022,2022-04-26,Committee recommended measure be held for further study,Sales And Use Taxes--liability And Computation
RI,H6605,1547739,https://legiscan.com/RI/bill/H6605/2022,https://legiscan.com/RI/text/H6605/2022,2022-01-06,"Introduced, referred to House Finance",Sales And Use Taxes -- Liability And Computation
WI,SB832,1547821,https://legiscan.com/WI/bill/SB832/2021,https://legiscan.com/WI/text/SB832/2021,2022-03-15,Failed to pass pursuant to Senate Joint Resolution 1,The provision of feminine hygiene products in school buildings and a school district revenue limit adjustment for costs of providing those products. (FE)
WA,SB5693,1547844,https://legiscan.com/WA/bill/SB5693/2021,https://legiscan.com/WA/text/SB5693/2021,2022-03-31,Effective date 3/31/2022.,Making 2021-2023 fiscal biennium supplemental operating appropriations.
VA,HB90,1548077,https://legiscan.com/VA/bill/HB90/2022,https://legiscan.com/VA/text/HB90/2022,2022-03-12,Continued to 2022 Sp. Sess. 1 pursuant to HJR455,Sales tax; exemption for food purchased for human consumption & essential personal hygiene products.
NY,S07697,1548427,https://legiscan.com/NY/bill/S07697/2021,https://legiscan.com/NY/text/S07697/2021,2022-02-24,SIGNED CHAP.72,"Provides menstrual products at no cost to menstruating individuals in temporary shelters, including, but not limited to, sanitary napkins, tampons and panty liners."
IL,HB4394,1548483,https://legiscan.com/IL/bill/HB4394/2021,https://legiscan.com/IL/text/HB4394/2021,2022-02-18,Rule 19(a) / Re-referred to Rules Committee,USE/OCC TX-EQUIPMENT
NE,LB881,1548635,https://legiscan.com/NE/bill/LB881/2021,https://legiscan.com/NE/text/LB881/2021,2022-04-20,Provisions/portions of LB881 amended into LB984 by AM2130,Provide a sales tax exemption for feminine hygiene products and require detention facilities to provide feminine hygiene products to prisoners free of charge
IN,HB1272,1548742,https://legiscan.com/IN/bill/HB1272/2022,https://legiscan.com/IN/text/HB1272/2022,2022-01-10,First reading: referred to Committee on Courts and Criminal Code,Health care for incarcerated women.
DE,SB205,1549241,https://legiscan.com/DE/bill/SB205/2021,https://legiscan.com/DE/text/SB205/2021,2022-06-14,Signed by Governor,An Act To Amend Title 14 Of The Delaware Code Relating To The Provision Of Free Feminine Hygiene Products.
IL,SB3065,1550587,https://legiscan.com/IL/bill/SB3065/2021,https://legiscan.com/IL/text/SB3065/2021,2022-03-25,Rule 19(a) / Re-referred to Rules Committee,USE/OCC TX-EQUIPMENT
CA,AB1624,1551318,https://legiscan.com/CA/bill/AB1624/2021,https://legiscan.com/CA/text/AB1624/2021,2022-01-20,Referred to Com. on BUDGET.,Budget Act of 2022.
CA,SB840,1551330,https://legiscan.com/CA/bill/SB840/2021,https://legiscan.com/CA/text/SB840/2021,2022-01-11,From printer.,Budget Act of 2022.
NY,A08783,1551655,https://legiscan.com/NY/bill/A08783/2021,https://legiscan.com/NY/text/A08783/2021,2022-01-31,substituted by s7697,"Provides menstrual products at no cost to menstruating individuals in temporary shelters, including, but not limited to, sanitary napkins, tampons and panty liners."
VA,HB696,1551860,https://legiscan.com/VA/bill/HB696/2022,https://legiscan.com/VA/text/HB696/2022,2022-02-02,Tabled in Finance (16-Y 5-N),Retail Sales and Use Tax; exemption for essential personal hygiene products.
NE,LB984,1551882,https://legiscan.com/NE/bill/LB984/2021,https://legiscan.com/NE/text/LB984/2021,2022-04-20,Provisions/portions of LB941 amended into LB984 by AM2130,"Change sales and use tax collection fees, provide a sales and use tax exemption for net wrap and feminine hygiene products, and require detention facilities to provide feminine hygiene products to female prisoners free of charge"
RI,H7085,1551924,https://legiscan.com/RI/bill/H7085/2022,https://legiscan.com/RI/text/H7085/2022,2022-02-10,Committee recommended measure be held for further study,The Rhode Island First Step Act
WV,HB2731,1552237,https://legiscan.com/WV/bill/HB2731/2022,https://legiscan.com/WV/text/HB2731/2022,2022-01-12,To House Health and Human Resources,Provide for disclosure of potentially harmful ingredients in menstrual products
MI,SB0804,1552339,https://legiscan.com/MI/bill/SB0804/2021,https://legiscan.com/MI/text/SB0804/2021,2022-01-12,Referred To Committee On Finance,Sales tax: exemptions; sale of incontinence products; exempt. Amends secs. 4a & 25 of 1933 PA 167 (MCL 205.54a & 205.75).
WV,HB3039,1552863,https://legiscan.com/WV/bill/HB3039/2022,https://legiscan.com/WV/text/HB3039/2022,2022-01-12,To House Finance,Exempting certain hygiene products from sales tax
WV,SB38,1553084,https://legiscan.com/WV/bill/SB38/2022,https://legiscan.com/WV/text/SB38/2022,2022-01-12,To Health and Human Resources,Relating to menstrual product package labeling
VA,HB848,1553307,https://legiscan.com/VA/bill/HB848/2022,https://legiscan.com/VA/text/HB848/2022,2022-02-02,Tabled in Finance (14-Y 7-N),Retail Sales and Use tax; exemption for incontinence products.
