state,bill_number,bill_id,url,text_url,last_action_date,last_action,title
IL,HB3055,1711511,https://legiscan.com/IL/bill/HB3055/2023,https://legiscan.com/IL/text/HB3055/2023,2023-08-01,Public Act . . . . . . . . . 103-0331,PRISONER RELIGIOUS RIGHTS
IL,HB3059,1711592,https://legiscan.com/IL/bill/HB3059/2023,https://legiscan.com/IL/text/HB3059/2023,2023-02-17,Referred to Rules Committee,USE/OCC TX-DIAPERS
IL,HB3093,1711614,https://legiscan.com/IL/bill/HB3093/2023,https://legiscan.com/IL/text/HB3093/2023,2024-01-30,Chief Senate Sponsor Sen. Cristina Castro,MENSTRUAL HYGIENE PRODUCTS
IL,HB3144,1711712,https://legiscan.com/IL/bill/HB3144/2023,https://legiscan.com/IL/text/HB3144/2023,2024-08-05,Public Act . . . . . . . . . 103-0781,DCEO-CHAMBER OF COMMERCE
RI,S0196,1712399,https://legiscan.com/RI/bill/S0196/2023,https://legiscan.com/RI/text/S0196/2023,2023-04-26,Committee recommended measure be held for further study,Comprehensive Pfas Ban Act Of 2023
RI,S0208,1712421,https://legiscan.com/RI/bill/S0208/2023,https://legiscan.com/RI/text/S0208/2023,2023-02-16,"Introduced, referred to Senate Finance",Sales And Use Taxes -- Liability And Computation
RI,S0217,1712471,https://legiscan.com/RI/bill/S0217/2023,https://legiscan.com/RI/text/S0217/2023,2023-02-16,"Introduced, referred to Senate Finance",Sales And Use Taxes -- Liability And Computation
IL,HB3434,1712490,https://legiscan.com/IL/bill/HB3434/2023,https://legiscan.com/IL/text/HB3434/2023,2023-03-10,Rule 19(a) / Re-referred to Rules Committee,BIDS-OCCUPATION/USE EXEMPTION
RI,H5673,1712505,https://legiscan.com/RI/bill/H5673/2023,https://legiscan.com/RI/text/H5673/2023,2023-03-23,Committee recommended measure be held for further study,Comprehensive Pfas Ban Act Of 2023
RI,S0266,1712530,https://legiscan.com/RI/bill/S0266/2023,https://legiscan.com/RI/text/S0266/2023,2023-05-09,Committee postponed at request of sponsor (05/09/2023),Liability And Computation
RI,S0210,1712591,https://legiscan.com/RI/bill/S0210/2023,https://legiscan.com/RI/text/S0210/2023,2023-02-16,"Introduced, referred to Senate Finance",Sales And Use Taxes -- Liability And Computation
RI,S0269,1712640,https://legiscan.com/RI/bill/S0269/2023,https://legiscan.com/RI/text/S0269/2023,2023-02-16,"Introduced, referred to Senate Finance",Sales And Use Taxes -- Liability And Computation
RI,S0440,1712644,https://legiscan.com/RI/bill/S0440/2023,https://legiscan.com/RI/text/S0440/2023,2023-04-19,Committee recommended measure be held for further study,Registration Of Vehicles -- Registration Of Commercial Fishing Vehicles
RI,S0270,1712765,https://legiscan.com/RI/bill/S0270/2023,https://legiscan.com/RI/text/S0270/2023,2023-02-16,"Introduced, referred to Senate Finance",Health And Safety Of Pupils
RI,S0209,1713126,https://legiscan.com/RI/bill/S0209/2023,https://legiscan.com/RI/text/S0209/2023,2023-02-16,"Introduced, referred to Senate Finance",Sales And Use Taxes -- Liability And Computation
IL,HB3565,1713708,https://legiscan.com/IL/bill/HB3565/2023,https://legiscan.com/IL/text/HB3565/2023,2023-03-10,Rule 19(a) / Re-referred to Rules Committee,REVENUE-MEGA PROJECTS
IL,HB3477,1713722,https://legiscan.com/IL/bill/HB3477/2023,https://legiscan.com/IL/text/HB3477/2023,2023-02-17,Referred to Rules Committee,USE/OCC TAX-FOOD AND MEDS
CA,SB760,1714711,https://legiscan.com/CA/bill/SB760/2023,https://legiscan.com/CA/text/SB760/2023,2023-09-23,"Chaptered by Secretary of State. Chapter 227, Statutes of 2023.",School facilities: all-gender restrooms.
MN,HF2073,1715300,https://legiscan.com/MN/bill/HF2073/2023,https://legiscan.com/MN/text/HF2073/2023,2023-05-24,Secretary of State Chapter 41 ,Higher education finance and policy bill.
OR,HB3326,1715794,https://legiscan.com/OR/bill/HB3326/2023,https://legiscan.com/OR/text/HB3326/2023,2023-06-25,In committee upon adjournment.,Relating to changing the name of the Oregon Health Authority; declaring an emergency.
OR,SB1034,1717264,https://legiscan.com/OR/bill/SB1034/2023,https://legiscan.com/OR/text/SB1034/2023,2023-08-15,"Effective date, July 31, 2023.",Relating to the payment of costs for educational services provided by programs operated by the military; and declaring an emergency.
OR,SB1002,1717280,https://legiscan.com/OR/bill/SB1002/2023,https://legiscan.com/OR/text/SB1002/2023,2023-08-15,"Effective date, July 31, 2023.",Relating to school facilities; and declaring an emergency.
KS,HB2435,1717681,https://legiscan.com/KS/bill/HB2435/2023,https://legiscan.com/KS/text/HB2435/2023,2024-04-30,House Died in Committee,"Decreasing the sales and use tax rate, establishing a 0% state rate for sales and use taxes for food and food ingredients, providing a sales tax exemption for children's diapers and feminine hygiene products, establishing the STAR bonds food sales tax revenue replacement fund and altering the calculation for STAR bond districts."
RI,H5784,1718016,https://legiscan.com/RI/bill/H5784/2023,https://legiscan.com/RI/text/H5784/2023,2023-06-15,Referred to Senate Environment and Agriculture,Forestry And Forest Product Operations
OR,HB3472,1718888,https://legiscan.com/OR/bill/HB3472/2023,https://legiscan.com/OR/text/HB3472/2023,2023-06-25,In committee upon adjournment.,Relating to the provision of menstrual products in student bathrooms.
TX,SB1146,1719406,https://legiscan.com/TX/bill/SB1146/2023,https://legiscan.com/TX/text/SB1146/2023,2023-06-18,Effective on 9/1/23,Relating to the medical transportation and care for certain inmates in the Texas Department of Criminal Justice.
TX,HB2749,1719778,https://legiscan.com/TX/bill/HB2749/2023,https://legiscan.com/TX/text/HB2749/2023,2023-04-18,Referred to Vet Affairs,Relating to the verification of the veteran status of inmates and prisoners.
TX,HB300,1719828,https://legiscan.com/TX/bill/HB300/2023,https://legiscan.com/TX/text/HB300/2023,2023-05-10,Co-sponsor authorized,Relating to an exemption from sales and use taxes for certain family care items.
IA,HF443,1720295,https://legiscan.com/IA/bill/HF443/2023,https://legiscan.com/IA/text/HF443/2023,2023-02-24,"Introduced, referred to State Government. H.J. 425.",A bill for an act relating to the provision of period products.
MN,SF2075,1720377,https://legiscan.com/MN/bill/SF2075/2023,https://legiscan.com/MN/text/SF2075/2023,2023-04-11,Comm report: To pass as amended and re-refer to Finance,Omnibus Higher Education appropriations
RI,H6015,1723717,https://legiscan.com/RI/bill/H6015/2023,https://legiscan.com/RI/text/H6015/2023,2023-05-09,Committee recommended measure be held for further study,Sales And Use Taxes -- Liability And Computation
RI,H6011,1724091,https://legiscan.com/RI/bill/H6011/2023,https://legiscan.com/RI/text/H6011/2023,2023-04-17,Committee recommended measure be held for further study,Gun Safe Tax Credit
RI,H5839,1724375,https://legiscan.com/RI/bill/H5839/2023,https://legiscan.com/RI/text/H5839/2023,2023-03-08,Committee recommended measure be held for further study,Rhode Island Business Corporation Act
TX,HB3172,1724477,https://legiscan.com/TX/bill/HB3172/2023,https://legiscan.com/TX/text/HB3172/2023,2023-03-15,Referred to Higher Education,Relating to the availability of menstrual products and lactation rooms at public institutions of higher education.
HI,SR23,1724754,https://legiscan.com/HI/bill/SR23/2023,https://legiscan.com/HI/text/SR23/2023,2023-05-22,Certified copies of resolutions sent.,"Urging The University Of Hawaii System To Provide Menstrual Products, Free Of Charge, To Students At All Of Its University, Community College, And Education Center Campuses As Part Of A Public Health And Education Equity Strategy That Addresses Economic Disparities."
HI,SCR27,1724764,https://legiscan.com/HI/bill/SCR27/2023,https://legiscan.com/HI/text/SCR27/2023,2023-04-17,"Report adopted; referred to the committee(s) on FIN with none voting aye with reservations; Representative(s) Garcia, Pierick voting no (2) and Representative(s) Lowen, Nakashima excused (2).","Urging The University Of Hawaii System To Provide Menstrual Products, Free Of Charge, To Students At All Of Its University, Community College, And Education Center Campuses As Part Of A Public Health And Education Equity Strategy That Addresses Economic Disparities."
NY,S05353,1725351,https://legiscan.com/NY/bill/S05353/2023,https://legiscan.com/NY/text/S05353/2023,2024-01-03,REFERRED TO HEALTH,Relates to the creation of a research program to determine the risks posed from chemicals in personal care products or menstrual products.
MN,HF2497,1725520,https://legiscan.com/MN/bill/HF2497/2023,https://legiscan.com/MN/text/HF2497/2023,2023-05-24,Secretary of State Chapter 55 ,Education finance bill.
MN,HF2488,1725901,https://legiscan.com/MN/bill/HF2488/2023,https://legiscan.com/MN/text/HF2488/2023,2023-03-06,Author added Pursell,"Higher education institutions required to provide access to menstrual products at no charge to students, and money appropriated."
TX,HB3337,1726069,https://legiscan.com/TX/bill/HB3337/2023,https://legiscan.com/TX/text/HB3337/2023,2023-03-15,Referred to Higher Education,Relating to the provision of menstrual products at public institutions of higher education.
TX,HB3739,1728135,https://legiscan.com/TX/bill/HB3739/2023,https://legiscan.com/TX/text/HB3739/2023,2023-05-12,Referred to Criminal Justice,Relating to the medical transportation and care for certain inmates in the Texas Department of Criminal Justice.
MN,SF2684,1728169,https://legiscan.com/MN/bill/SF2684/2023,https://legiscan.com/MN/text/SF2684/2023,2023-04-21,"Rule 45-amend, subst. General Orders HF2497, SF indefinitely postponed",Omnibus Education appropriations
RI,S0552,1729907,https://legiscan.com/RI/bill/S0552/2023,https://legiscan.com/RI/text/S0552/2023,2023-03-07,"Introduced, referred to Senate Finance",Sales And Use Taxes -- Liability And Computation
RI,S0557,1730008,https://legiscan.com/RI/bill/S0557/2023,https://legiscan.com/RI/text/S0557/2023,2023-03-07,"Introduced, referred to Senate Finance",Sales And Use Taxes -- Liability And Computation
TX,HB4017,1730379,https://legiscan.com/TX/bill/HB4017/2023,https://legiscan.com/TX/text/HB4017/2023,2023-03-20,Referred to Public Education,Relating to human sexuality education in public schools.
CT,HB06880,1730968,https://legiscan.com/CT/bill/HB06880/2023,https://legiscan.com/CT/text/HB06880/2023,2023-06-27,Signed by the Governor,An Act Concerning Teachers And Paraeducators.
CT,HB06888,1731167,https://legiscan.com/CT/bill/HB06888/2023,https://legiscan.com/CT/text/HB06888/2023,2023-06-27,Signed by the Governor,An Act Concerning Juvenile Justice.
TX,HB4199,1731201,https://legiscan.com/TX/bill/HB4199/2023,https://legiscan.com/TX/text/HB4199/2023,2023-05-02,Left pending in committee,Relating to the provision of menstrual products at public schools.
CT,HB06882,1731244,https://legiscan.com/CT/bill/HB06882/2023,https://legiscan.com/CT/text/HB06882/2023,2023-06-28,Signed by the Governor,An Act Concerning Education Mandate Relief And Other Technical And Assorted Revisions And Additions To The Education And Early Childhood Education Statutes.
NJ,SJR121,1732331,https://legiscan.com/NJ/bill/SJR121/2022,https://legiscan.com/NJ/text/SJR121/2022,2023-05-22,Substituted by AJR113,"Establishes the last full week of May as ""Period Poverty Awareness Week."""
HI,SCR87,1732763,https://legiscan.com/HI/bill/SCR87/2023,https://legiscan.com/HI/text/SCR87/2023,2023-04-17,"Report adopted. referred to the committee(s) on FIN as amended in HD 1 with none voting aye with reservations; Representative(s) Garcia voting no (1) and Representative(s) Lowen, Nakashima excused (2).",Requesting The Department Of Accounting And General Services To Provide Menstrual Products At No Cost In State Buildings Under The Jurisdiction Of The Department Of Accounting And General Services That Are Open To The Public And Contain Public Restrooms.
HI,SR78,1732780,https://legiscan.com/HI/bill/SR78/2023,https://legiscan.com/HI/text/SR78/2023,2023-05-22,Certified copies of resolutions sent.,Requesting The Department Of Accounting And General Services To Provide Menstrual Products At No Cost In State Buildings Under The Jurisdiction Of The Department Of Accounting And General Services That Are Open To The Public And Contain Public Restrooms.
MA,S1381,1733897,https://legiscan.com/MA/bill/S1381/2023,https://legiscan.com/MA/text/S1381/2023,2023-10-26,"New draft substituted, see S2481",To increase access to disposable menstrual products
HI,HCR132,1734332,https://legiscan.com/HI/bill/HCR132/2023,https://legiscan.com/HI/text/HCR132/2023,2023-03-31,"Report adopted. referred to the committee(s) on FIN as amended in HD 1 with Representative(s) Garcia voting aye with reservations; none voting no (0) and Representative(s) Gates, Ichiyama, Ilagan, Kila, Poepoe, Quinlan excused (6).",Requesting The Department Of Accounting And General Services To Provide Menstrual Products At No Cost In State Buildings Under The Jurisdiction Of The Department Of Accounting And General Services That Are Open To The Public And Contain Public Restrooms.
HI,HR133,1735178,https://legiscan.com/HI/bill/HR133/2023,https://legiscan.com/HI/text/HR133/2023,2023-03-31,"Report adopted. referred to the committee(s) on FIN as amended in HD 1 with Representative(s) Garcia voting aye with reservations; none voting no (0) and Representative(s) Gates, Ichiyama, Ilagan, Kila, Poepoe, Quinlan excused (6).",Requesting The Department Of Accounting And General Services To Provide Menstrual Products At No Cost In State Buildings Under The Jurisdiction Of The Department Of Accounting And General Services That Are Open To The Public And Contain Public Restrooms.
MA,S480,1735839,https://legiscan.com/MA/bill/S480/2023,https://legiscan.com/MA/text/S480/2023,2024-02-15,Bill reported favorably by committee and referred to the committee on Senate Ways and Means,Protecting wastewater and sewerage systems through the labeling of non-flushable wipes
MA,S1356,1736243,https://legiscan.com/MA/bill/S1356/2023,https://legiscan.com/MA/text/S1356/2023,2024-03-25,"Accompanied a new draft, see H4486",To protect Massachusetts public health from PFAS
MA,S1449,1736584,https://legiscan.com/MA/bill/S1449/2023,https://legiscan.com/MA/text/S1449/2023,2024-02-15,"Accompanied a study order, see S2648",To ban single use plastic applicators
MA,S145,1736841,https://legiscan.com/MA/bill/S145/2023,https://legiscan.com/MA/text/S145/2023,2023-09-28,Bill reported favorably by committee and referred to the committee on Senate Ways and Means,Relative to menstrual product ingredient disclosure
MA,H1255,1737573,https://legiscan.com/MA/bill/H1255/2023,https://legiscan.com/MA/text/H1255/2023,2024-01-22,"Accompanied a new draft, see H4267",Requiring menstrual products in buildings on public higher education campuses
MA,H534,1737603,https://legiscan.com/MA/bill/H534/2023,https://legiscan.com/MA/text/H534/2023,2023-09-28,Accompanied S1381,To increase access to disposable menstrual products
MA,H563,1738668,https://legiscan.com/MA/bill/H563/2023,https://legiscan.com/MA/text/H563/2023,2024-03-18,Read second and ordered to a third reading,Concerning disposable menstrual products in schools
ID,H0313,1738870,https://legiscan.com/ID/bill/H0313/2023,https://legiscan.com/ID/text/H0313/2023,2023-03-20,Filed in Office of the Chief Clerk,Adds to existing law to require the provision of feminine hygiene products.
MA,H805,1739050,https://legiscan.com/MA/bill/H805/2023,https://legiscan.com/MA/text/H805/2023,2024-02-15,Accompanied S480,Protecting wastewater and sewerage systems through the labeling of non-flushable wipes
MI,SB0173,1739517,https://legiscan.com/MI/bill/SB0173/2023,https://legiscan.com/MI/text/SB0173/2023,2023-08-22,Assigned Pa 103'23 With Immediate Effect,"Appropriations: school aid omnibus; appropriations in the school aid act for fiscal year 2023-2024; provide for. Amends, adds & repeals (See bill)."
MA,H3018,1739726,https://legiscan.com/MA/bill/H3018/2023,https://legiscan.com/MA/text/H3018/2023,2023-10-30,Bill reported favorably by committee and referred to the committee on House Ways and Means,Requiring menstrual products in all state buildings
NV,AB292,1739947,https://legiscan.com/NV/bill/AB292/2023,https://legiscan.com/NV/text/AB292/2023,2023-06-16,Chapter 473.,Revises provisions governing offenders. (BDR 16-252)
NV,SJR5,1740009,https://legiscan.com/NV/bill/SJR5/2023,https://legiscan.com/NV/text/SJR5/2023,2023-05-15,"File No. 20. (Effective May 8, 2023)","Urges Congress to expand the Supplemental Nutrition Assistance Program and the Special Supplemental Nutrition Program for Women, Infants and Children to cover the purchase of menstrual products. (BDR R-980)"
MA,H2197,1741503,https://legiscan.com/MA/bill/H2197/2023,https://legiscan.com/MA/text/H2197/2023,2024-03-25,"Accompanied a new draft, see H4486",To protect Massachusetts public health from PFAS
LA,HB117,1741746,https://legiscan.com/LA/bill/HB117/2023,https://legiscan.com/LA/text/HB117/2023,2023-05-26,Read by title. Recommitted to the Committee on Finance.,Requires public schools to provide free menstrual products in easily accessible locations (EG INCREASE SG EX See Note)
NY,A05502,1742220,https://legiscan.com/NY/bill/A05502/2023,https://legiscan.com/NY/text/A05502/2023,2024-01-03,referred to social services,"Provides an additional monthly public assistance allowance of $10 for menstrual products, including but not limited to, tampons, sanitary napkins, cups and panty liners."
MA,H2138,1742556,https://legiscan.com/MA/bill/H2138/2023,https://legiscan.com/MA/text/H2138/2023,2023-09-28,Accompanied S145,Relative to menstrual product ingredient disclosure
OH,HB118,1743263,https://legiscan.com/OH/bill/HB118/2023,https://legiscan.com/OH/text/HB118/2023,2023-06-14,Reported: Ways and Means,Exempt certain baby products from sales and use tax
AL,SB88,1745017,https://legiscan.com/AL/bill/SB88/2023,https://legiscan.com/AL/text/SB88/2023,2023-05-26,Enacted,FY24 Education Trust Fund - Governor's Rec.
AL,HB169,1745230,https://legiscan.com/AL/bill/HB169/2023,https://legiscan.com/AL/text/HB169/2023,2023-03-21,Introduced and Referred to House Ways and Means Education,"To make appropriations for the support, maintenance and development of public education in Alabama, for debt service, and for capital outlay for the fiscal year ending September 30, 2024.  "
NY,S05913,1745409,https://legiscan.com/NY/bill/S05913/2023,https://legiscan.com/NY/text/S05913/2023,2023-11-17,APPROVAL MEMO.31,Requires menstrual products to be offered for free in non-public schools.
NY,S05910,1745526,https://legiscan.com/NY/bill/S05910/2023,https://legiscan.com/NY/text/S05910/2023,2024-06-05,SUBSTITUTED BY A4060A,Requires menstrual products in all public college and university buildings.
US,SB919,1746023,https://legiscan.com/US/bill/SB919/2023,https://legiscan.com/US/text/SB919/2023,2023-03-22,Read twice and referred to the Committee on Environment and Public Works.,A. Donald McEachin Environmental Justice For All Act
US,HB1705,1746101,https://legiscan.com/US/bill/HB1705/2023,https://legiscan.com/US/text/HB1705/2023,2023-04-25,Referred to the Subcommittee on Forestry.,A. Donald McEachin Environmental Justice For All Act
NV,SB428,1748170,https://legiscan.com/NV/bill/SB428/2023,https://legiscan.com/NV/text/SB428/2023,2023-06-15,Approved by the Governor. Chapter 425.,Proposes to exempt sales of diapers from sales and use taxes and analogous taxes upon approval by the voters. (BDR 32-1033)
NY,A05990,1749122,https://legiscan.com/NY/bill/A05990/2023,https://legiscan.com/NY/text/A05990/2023,2024-06-03,amended on third reading 5990c,Restricts certain substances from being used in menstrual products.
RI,S0862,1751588,https://legiscan.com/RI/bill/S0862/2023,https://legiscan.com/RI/text/S0862/2023,2023-05-09,Committee recommended measure be held for further study,Property Subject To Taxation
PA,HB799,1751788,https://legiscan.com/PA/bill/HB799/2023,https://legiscan.com/PA/text/HB799/2023,2023-04-03,Referred to EDUCATION,"In school health services, providing for menstrual hygiene products."
NC,S503,1752134,https://legiscan.com/NC/bill/S503/2023,https://legiscan.com/NC/text/S503/2023,2023-04-04,Ref To Com On Rules and Operations of the Senate,Menstrual Products Sales Tax Exemption
NC,S556,1752961,https://legiscan.com/NC/bill/S556/2023,https://legiscan.com/NC/text/S556/2023,2023-04-05,Ref To Com On Rules and Operations of the Senate,End Menstrual Poverty Act
PA,HB850,1753374,https://legiscan.com/PA/bill/HB850/2023,https://legiscan.com/PA/text/HB850/2023,2024-07-08,Re-referred to APPROPRIATIONS,"In public assistance, providing for waiver to purchase diapers or menstrual hygiene products."
PA,HB851,1753489,https://legiscan.com/PA/bill/HB851/2023,https://legiscan.com/PA/text/HB851/2023,2024-06-07,Referred to EDUCATION,"In school health services, providing for Menstrual Hygiene Products Accessibility Grant Program; and making an appropriation."
NC,S741,1753800,https://legiscan.com/NC/bill/S741/2023,https://legiscan.com/NC/text/S741/2023,2023-04-10,Ref To Com On Rules and Operations of the Senate,Tax Relief on Essentials for Working Families
PA,HB900,1754614,https://legiscan.com/PA/bill/HB900/2023,https://legiscan.com/PA/text/HB900/2023,2023-12-14,Act No. 47 of 2023,"In general administration, further providing for State recording system for application of restraints to pregnant prisoners or detainees; in county correctional institutions, further providing for county recording system for application of restraints to pregnant prisoners or detainees; providing for Department of Human Services facilities; and, in miscellaneous provisions, further providing for healthy birth for incarcerated women and providing for restrictive housing prohibited for pregnant or postpartum incarcerated individuals and detainees, for cavity search and inspection restrictions, for training and education requirement, for feminine hygiene and incontinence products and for postpartum recovery."
NC,H622,1755518,https://legiscan.com/NC/bill/H622/2023,https://legiscan.com/NC/text/H622/2023,2023-04-18,"Ref To Com On Rules, Calendar, and Operations of the House",Menstrual Equity for All Act
WI,SB219,1755786,https://legiscan.com/WI/bill/SB219/2023,https://legiscan.com/WI/text/SB219/2023,2024-04-15,Failed to pass pursuant to Senate Joint Resolution 1,Sales and use tax exemption for diapers and feminine hygiene products. (FE)
TX,HR1128,1755829,https://legiscan.com/TX/bill/HR1128/2023,https://legiscan.com/TX/text/HR1128/2023,2023-04-28,Reported enrolled,Congratulating Sable Clift of Galveston ISD on winning first place in the Texas Science and Engineering Fair Junior Division.
LA,HB641,1757305,https://legiscan.com/LA/bill/HB641/2023,https://legiscan.com/LA/text/HB641/2023,2023-05-23,"Read by title, amended, returned to the calendar.","Provides for the termination of certain tax exemptions, exclusions, credits, deductions, and other tax incentives (EG INCREASE GF RV See Note)"
IL,HB4040,1757515,https://legiscan.com/IL/bill/HB4040/2023,https://legiscan.com/IL/text/HB4040/2023,2023-05-03,Added Chief Co-Sponsor Rep. Stephanie A. Kifowit,REVENUE-MEGAPROJECTS
IL,HB4040,1757515,https://legiscan.com/IL/bill/HB4040/2023,https://legiscan.com/IL/text/HB4040/2023,2023-05-03,Added Chief Co-Sponsor Rep. Stephanie A. Kifowit,REVENUE-MEGAPROJECTS
WI,AB226,1757846,https://legiscan.com/WI/bill/AB226/2023,https://legiscan.com/WI/text/AB226/2023,2024-04-15,Failed to pass pursuant to Senate Joint Resolution 1,Exemptions to the sale of diapers and feminine hygiene products. (FE)
US,SB1350,1759830,https://legiscan.com/US/bill/SB1350/2023,https://legiscan.com/US/text/SB1350/2023,2023-04-27,"Read twice and referred to the Committee on Commerce, Science, and Transportation.",WIPPES Act Wastewater Infrastructure Pollution Prevention and Environmental Safety Act
US,HB2964,1759931,https://legiscan.com/US/bill/HB2964/2023,https://legiscan.com/US/text/HB2964/2023,2024-06-12,"Received in the Senate and Read twice and referred to the Committee on Commerce, Science, and Transportation.",Wastewater Infrastructure Pollution Prevention and Environmental Safety Act WIPPES Act
RI,H6347,1759964,https://legiscan.com/RI/bill/H6347/2023,https://legiscan.com/RI/text/H6347/2023,2023-04-28,"Introduced, referred to House Finance",Registration Of Vehicles -- Registration Of Commercial Fishing Vehicles
US,HR351,1760966,https://legiscan.com/US/bill/HR351/2023,https://legiscan.com/US/text/HR351/2023,2023-05-05,Referred to the Subcommittee on Health.,"Recognizing the impact the stigmatization of menstruation has on the lives of women, girls, and people who menstruate, and expressing support for the designation of the month of May as ""National Menstrual Health Awareness Month""."
AL,HB438,1761416,https://legiscan.com/AL/bill/HB438/2023,https://legiscan.com/AL/text/HB438/2023,2023-05-04,Introduced and Referred to House Ways and Means Education,"To amend Section 40-23-4, as last amended by Act 2022-291, Act 2022-293, Act 2022-373, and Act 2022-199, Code of Alabama 1975, relating to sales tax exemptions; to provide for a sales and use tax exemption for certain purchases of diapers; to provide for a sales and use tax exemption for certain purchases of menstrual hygiene products; to provide for definitions; and to provide for rulemaking authority.    "
CA,AR34,1761501,https://legiscan.com/CA/bill/AR34/2023,https://legiscan.com/CA/text/AR34/2023,2023-05-22,Read. Adopted. (Page 1682.).,Relative to Period Poverty Awareness Week.
CA,SR36,1761505,https://legiscan.com/CA/bill/SR36/2023,https://legiscan.com/CA/text/SR36/2023,2023-06-08,Read. Adopted. (Ayes 36. Noes 0. Page 1490.),Relative to Period Poverty Awareness Week.
AZ,HB2810,1762319,https://legiscan.com/AZ/bill/HB2810/2023,https://legiscan.com/AZ/text/HB2810/2023,2023-05-10,House Committee of the Whole action: Do Pass Amended,General appropriations act; 2023-2024
