state,bill_number,bill_id,url,text_url,last_action_date,last_action,title
RI,S0152,1439149,https://legiscan.com/RI/bill/S0152/2021,https://legiscan.com/RI/text/S0152/2021,2021-03-17,Committee recommended measure be held for further study,Health And Safety Of Pupils
RI,S0165,1439224,https://legiscan.com/RI/bill/S0165/2021,https://legiscan.com/RI/text/S0165/2021,2021-03-11,Committee recommended measure be held for further study,Sales And Use Taxes--liability And Computation
RI,S0164,1439363,https://legiscan.com/RI/bill/S0164/2021,https://legiscan.com/RI/text/S0164/2021,2021-03-11,Committee recommended measure be held for further study,Sales And Use Taxes--liability And Computation
TN,HB0640,1440749,https://legiscan.com/TN/bill/HB0640/2021,https://legiscan.com/TN/text/HB0640/2021,2021-05-03,Comp. became Pub. Ch. 207,"AN ACT to amend Tennessee Code Annotated, Title 29, Chapter 28 and Title 53, relative to feminine hygiene product donation."
LA,HB7,1441867,https://legiscan.com/LA/bill/HB7/2021,https://legiscan.com/LA/text/HB7/2021,2021-06-23,Effective date: 06/23/2021.,"Provides for a sales and use tax exemption for feminine hygiene products and diapers (EN -$11,100,000 GF RV See Note)"
KS,SB180,1442358,https://legiscan.com/KS/bill/SB180/2021,https://legiscan.com/KS/text/SB180/2021,2022-05-23,Senate Died on General Orders,Providing a sales tax exemption for certain purchases by disabled veterans.
TN,SB0974,1445021,https://legiscan.com/TN/bill/SB0974/2021,https://legiscan.com/TN/text/SB0974/2021,2021-05-03,Effective date(s) 07/01/2021,"AN ACT to amend Tennessee Code Annotated, Title 29, Chapter 28 and Title 53, relative to feminine hygiene product donation."
TN,HB1031,1445110,https://legiscan.com/TN/bill/HB1031/2021,https://legiscan.com/TN/text/HB1031/2021,2021-05-03,"Taken off notice for cal in s/c Finance, Ways, and Means Subcommittee of Finance, Ways, and Means Committee","AN ACT to amend Tennessee Code Annotated, Title 67, Chapter 6, relative to sales and use tax exemptions."
NY,A05158,1447980,https://legiscan.com/NY/bill/A05158/2021,https://legiscan.com/NY/text/A05158/2021,2022-01-05,referred to ways and means,Requires feminine hygiene products to be offered for free in non-public schools.
RI,S0251,1449074,https://legiscan.com/RI/bill/S0251/2021,https://legiscan.com/RI/text/S0251/2021,2021-04-08,Referred to House Health & Human Services,Correctional Institutions - Station Houses For Women
RI,S0218,1449803,https://legiscan.com/RI/bill/S0218/2021,https://legiscan.com/RI/text/S0218/2021,2021-06-16,Referred to House Finance,Sales And Use Taxes -- Liability And Computation
RI,H5527,1450434,https://legiscan.com/RI/bill/H5527/2021,https://legiscan.com/RI/text/H5527/2021,2021-05-20,Committee recommended measure be held for further study,Sales And Use Taxes -- Liability And Computation
WV,SB287,1451176,https://legiscan.com/WV/bill/SB287/2021,https://legiscan.com/WV/text/SB287/2021,2021-02-13,To Education,Requiring county boards of education to provide free feminine hygiene products in grades six through 12
WV,SB291,1451186,https://legiscan.com/WV/bill/SB291/2021,https://legiscan.com/WV/text/SB291/2021,2021-02-13,To Finance,Exempting certain hygiene products from sales tax
RI,H5606,1451625,https://legiscan.com/RI/bill/H5606/2021,https://legiscan.com/RI/text/H5606/2021,2021-05-20,Committee recommended measure be held for further study,Sales And Use Taxes--liability And Computation
OH,HB110,1453187,https://legiscan.com/OH/bill/HB110/2021,https://legiscan.com/OH/text/HB110/2021,2021-07-01,"Effective 6/30/21 - Operating appropriations effective June 30, 2021. Other provisions generally effective September 30, 2021. Some provisions subject to special effective dates.",Creates appropriations for FY 2022-2023.
CA,AB775,1453444,https://legiscan.com/CA/bill/AB775/2021,https://legiscan.com/CA/text/AB775/2021,2022-09-30,"Chaptered by Secretary of State - Chapter 942, Statutes of 2022.",Contribution requirements: recurring contributions.
CA,AB818,1453487,https://legiscan.com/CA/bill/AB818/2021,https://legiscan.com/CA/text/AB818/2021,2021-10-06,"Chaptered by Secretary of State - Chapter 590, Statutes of 2021.",Solid waste: premoistened nonwoven disposable wipes.
NC,S105,1453588,https://legiscan.com/NC/bill/S105/2021,https://legiscan.com/NC/text/S105/2021,2021-11-18,Ch. SL 2021-180,2021 Appropriations Act
NC,H103,1453610,https://legiscan.com/NC/bill/H103/2021,https://legiscan.com/NC/text/H103/2021,2022-07-11,Ch. SL 2022-74,2022 Appropriations Act
WV,HB2564,1453675,https://legiscan.com/WV/bill/HB2564/2021,https://legiscan.com/WV/text/HB2564/2021,2021-02-17,To House Education,Requiring free feminine hygiene products in grades 6 through 12
SC,S0574,1454252,https://legiscan.com/SC/bill/S0574/2021,https://legiscan.com/SC/text/S0574/2021,2021-02-17,Referred to Committee on Medical Affairs,"Tax exemption, feminine hygiene products"
CT,HB06473,1454570,https://legiscan.com/CT/bill/HB06473/2021,https://legiscan.com/CT/text/HB06473/2021,2021-04-26,Referred by House to Committee on Appropriations,An Act Expanding The Diaper Bank To Include Feminine Hygiene Products.
MI,SB0153,1455061,https://legiscan.com/MI/bill/SB0153/2021,https://legiscan.com/MI/text/SB0153/2021,2021-11-09,Assigned Pa 0109'21 With Immediate Effect,Use tax: exemptions; sale of feminine hygiene products; exempt. Amends secs. 4 & 21 of 1937 PA 94 (MCL 205.94 & 205.111).
RI,S0301,1455133,https://legiscan.com/RI/bill/S0301/2021,https://legiscan.com/RI/text/S0301/2021,2021-03-11,Committee recommended measure be held for further study,Sales And Use Taxes--liability And Computation
MI,SB0154,1455174,https://legiscan.com/MI/bill/SB0154/2021,https://legiscan.com/MI/text/SB0154/2021,2021-02-18,Referred To Committee On Finance,Sales tax: exemptions; sale of feminine hygiene products; exempt. Amends secs. 4a & 25 of 1933 PA 167 (MCL 205.54a & 205.75). TIE BAR WITH: HB 4270'21
RI,S0298,1455183,https://legiscan.com/RI/bill/S0298/2021,https://legiscan.com/RI/text/S0298/2021,2021-03-11,Committee recommended measure be held for further study,Sales And Use Taxes -- Liability And Computation
RI,S0299,1455204,https://legiscan.com/RI/bill/S0299/2021,https://legiscan.com/RI/text/S0299/2021,2021-03-11,Committee recommended measure be held for further study,Sales And Use Taxes - Liability And Computation
MI,HB4270,1455430,https://legiscan.com/MI/bill/HB4270/2021,https://legiscan.com/MI/text/HB4270/2021,2021-10-19,Referred To Committee On Finance,Use tax: exemptions; sale of feminine hygiene products; exempt. Amends secs. 4 & 21 of 1937 PA 94 (MCL 205.94 & 205.111).
MI,HB4271,1455560,https://legiscan.com/MI/bill/HB4271/2021,https://legiscan.com/MI/text/HB4271/2021,2021-02-23,Bill Electronically Reproduced 02/18/2021,Sales tax: exemptions; sale of feminine hygiene products; exempt. Amends secs. 4a & 25 of 1933 A 167 (MCL 205.54a & 205.75). TIE BAR WITH: HB 4270'21
TX,HB1953,1457492,https://legiscan.com/TX/bill/HB1953/2021,https://legiscan.com/TX/text/HB1953/2021,2021-04-26,Received from the House,Relating to liability for the donation and distribution of feminine hygiene products.
IL,SB0294,1457885,https://legiscan.com/IL/bill/SB0294/2021,https://legiscan.com/IL/text/SB0294/2021,2021-08-06,Public Act . . . . . . . . . 102-0286,WIPES LABELING ACT
IL,HB3579,1458299,https://legiscan.com/IL/bill/HB3579/2021,https://legiscan.com/IL/text/HB3579/2021,2021-03-27,Rule 19(a) / Re-referred to Rules Committee,IL FIRST STEP
OR,HB3294,1460615,https://legiscan.com/OR/bill/HB3294/2021,https://legiscan.com/OR/text/HB3294/2021,2021-09-25,"Chapter 635, (2021 Laws): Effective date July 27, 2021.",Relating to feminine hygiene products in public schools; and declaring an emergency.
OH,SB98,1463447,https://legiscan.com/OH/bill/SB98/2021,https://legiscan.com/OH/text/SB98/2021,2021-03-03,Refer to Committee: Ways and Means,Exempt from sales tax - items used to move products /goods
MN,SF1414,1463516,https://legiscan.com/MN/bill/SF1414/2021,https://legiscan.com/MN/text/SF1414/2021,2021-02-25,Referred to Health and Human Services Finance and Policy,"Human services older adults continuing care, children and family services, community supports, health care, licensing and background studies, and technical modifications; conforming provisions modifications"
RI,H5684,1463701,https://legiscan.com/RI/bill/H5684/2021,https://legiscan.com/RI/text/H5684/2021,2021-05-20,Committee recommended measure be held for further study,Sales And Use Taxes--liability And Computation
RI,H5786,1463819,https://legiscan.com/RI/bill/H5786/2021,https://legiscan.com/RI/text/H5786/2021,2021-05-20,Committee recommended measure be held for further study,Gun Safe Tax Credit
RI,H5812,1463947,https://legiscan.com/RI/bill/H5812/2021,https://legiscan.com/RI/text/H5812/2021,2021-05-20,Committee recommended measure be held for further study,Sales And Use Taxes - Liability And Computation
RI,H5798,1464006,https://legiscan.com/RI/bill/H5798/2021,https://legiscan.com/RI/text/H5798/2021,2021-05-20,Committee recommended measure be held for further study,Sales And Use Taxes--liability And Computation
MN,HF1510,1465001,https://legiscan.com/MN/bill/HF1510/2021,https://legiscan.com/MN/text/HF1510/2021,2021-02-25,"Introduction and first reading, referred to Human Services Finance and Policy","Older adult continuing care, children and family services, community supports, health care and licensing and background studies policies modified; and technical and conforming changes made."
MN,HF1532,1465338,https://legiscan.com/MN/bill/HF1532/2021,https://legiscan.com/MN/text/HF1532/2021,2021-04-09,Second reading,Human services community supports provisions modified.
RI,S0368,1465532,https://legiscan.com/RI/bill/S0368/2021,https://legiscan.com/RI/text/S0368/2021,2021-03-11,Committee recommended measure be held for further study,Sales And Use Taxes -- Liability And Computation
PA,HB700,1465800,https://legiscan.com/PA/bill/HB700/2021,https://legiscan.com/PA/text/HB700/2021,2021-02-26,Referred to JUDICIARY,"In miscellaneous provisions relating to inmate confinement, providing for feminine hygiene products."
IL,SB2435,1468922,https://legiscan.com/IL/bill/SB2435/2021,https://legiscan.com/IL/text/SB2435/2021,2021-08-20,Public Act . . . . . . . . . 102-0558,FIRST 2021 GENERAL REVISORY
OH,SB114,1470856,https://legiscan.com/OH/bill/SB114/2021,https://legiscan.com/OH/text/SB114/2021,2021-03-03,Refer to Committee: Ways and Means,Exempt diapers from sales and use tax
AR,HB1611,1471037,https://legiscan.com/AR/bill/HB1611/2021,https://legiscan.com/AR/text/HB1611/2021,2021-04-26,Notification that HB1611 is now Act 933,To Allow Public Schools And Open-enrollment Public Charter Schools To Use Funding To Provide Feminine Hygiene Products At No Charge In Each Public School And Open-enrollment Public Charter School.
OH,SB112,1471056,https://legiscan.com/OH/bill/SB112/2021,https://legiscan.com/OH/text/SB112/2021,2022-03-01,Refer to Committee: Ways and Means,Regards tax foreclosures and land reutilization corporations
MN,SF1801,1472620,https://legiscan.com/MN/bill/SF1801/2021,https://legiscan.com/MN/text/SF1801/2021,2021-03-04,Referred to Human Services Reform Finance and Policy,Community supports provisions modifications
RI,S0476,1473847,https://legiscan.com/RI/bill/S0476/2021,https://legiscan.com/RI/text/S0476/2021,2021-03-11,Committee recommended measure be held for further study,Liability And Computation
TX,SB710,1474650,https://legiscan.com/TX/bill/SB710/2021,https://legiscan.com/TX/text/SB710/2021,2021-04-15,Committee report printed and distributed,Relating to the continuation and functions of the Commission on Jail Standards.
MO,HB9,1476494,https://legiscan.com/MO/bill/HB9/2021,https://legiscan.com/MO/text/HB9/2021,2021-06-30,Delivered to Secretary of State (G),NO TITLE
WV,HB3039,1477496,https://legiscan.com/WV/bill/HB3039/2021,https://legiscan.com/WV/text/HB3039/2021,2021-03-10,To House Finance,Exempting certain hygiene products from sales tax
NV,AB224,1477900,https://legiscan.com/NV/bill/AB224/2021,https://legiscan.com/NV/text/AB224/2021,2021-06-14,Chapter 503.,Provides for access to menstrual products in certain public schools. (BDR 34-767)
TX,HB1545,1478051,https://legiscan.com/TX/bill/HB1545/2021,https://legiscan.com/TX/text/HB1545/2021,2021-06-04,Effective on 9/1/21,Relating to the continuation and functions of the Commission on Jail Standards.
MN,HF2127,1479257,https://legiscan.com/MN/bill/HF2127/2021,https://legiscan.com/MN/text/HF2127/2021,2021-04-12,"Committee report, to adopt as amended and re-refer to Ways and Means","Children and family services, community supports, direct care and treatment, and chemical and mental health services provisions modified; forecast adjustments made; reports required; money transferred; technical and conforming changes made; and money appropriated."
MN,HF2128,1479466,https://legiscan.com/MN/bill/HF2128/2021,https://legiscan.com/MN/text/HF2128/2021,2021-05-25,Secretary of State Chapter 30 ,Omnibus health and human services policy and finance bill.
TX,SB1552,1479685,https://legiscan.com/TX/bill/SB1552/2021,https://legiscan.com/TX/text/SB1552/2021,2021-03-24,Referred to Jurisprudence,"Relating to the age of a child at which a juvenile court may exercise jurisdiction over the child, to the age of criminal responsibility, and to certain substantive and procedural matters related to those ages."
TX,HB4102,1480788,https://legiscan.com/TX/bill/HB4102/2021,https://legiscan.com/TX/text/HB4102/2021,2021-03-29,Referred to Corrections,Relating to certain substance abuse treatment programs operated by the Texas Department of Criminal Justice.
TX,HB4371,1481417,https://legiscan.com/TX/bill/HB4371/2021,https://legiscan.com/TX/text/HB4371/2021,2021-04-29,Failed to receive affirmative vote in comm.,"Relating to juvenile justice reform, including the age of a child at which a juvenile court may exercise jurisdiction over the child and the age of criminal responsibility."
WV,HB3174,1482409,https://legiscan.com/WV/bill/HB3174/2021,https://legiscan.com/WV/text/HB3174/2021,2021-03-15,To House Judiciary,Require Correctional Facilities to provide free feminine hygiene products
VT,H0436,1486239,https://legiscan.com/VT/bill/H0436/2021,https://legiscan.com/VT/text/H0436/2021,2021-05-21,"House message: Governor approved bill on June 8, 2021",An act relating to miscellaneous changes to Vermonts tax laws
OH,SB147,1488385,https://legiscan.com/OH/bill/SB147/2021,https://legiscan.com/OH/text/SB147/2021,2021-04-21,Refer to Committee: Ways and Means,Exempt 501(c)(3) gym/recreation memberships from sales tax
US,SB984,1488608,https://legiscan.com/US/bill/SB984/2021,https://legiscan.com/US/text/SB984/2021,2021-03-25,Read twice and referred to the Committee on Finance.,Break Free From Plastic Pollution Act of 2021
US,HB2238,1489074,https://legiscan.com/US/bill/HB2238/2021,https://legiscan.com/US/text/HB2238/2021,2022-06-30,Subcommittee Hearings Held.,Break Free From Plastic Pollution Act of 2021
OH,HB241,1490259,https://legiscan.com/OH/bill/HB241/2021,https://legiscan.com/OH/text/HB241/2021,2021-04-14,Refer to Committee: State and Local Government,"Regards tax foreclosures, county land reutilization corps"
RI,S0754,1490736,https://legiscan.com/RI/bill/S0754/2021,https://legiscan.com/RI/text/S0754/2021,2021-04-15,Committee recommended measure be held for further study,Sales And Use Taxes - Liability And Computation
LA,HB444,1490881,https://legiscan.com/LA/bill/HB444/2021,https://legiscan.com/LA/text/HB444/2021,2021-04-12,"Read by title, under the rules, referred to the Committee on Ways and Means.","Provides for the termination of certain tax exemptions, exclusions, credits, deductions, and other tax incentives"
MN,SF2360,1491669,https://legiscan.com/MN/bill/SF2360/2021,https://legiscan.com/MN/text/SF2360/2021,2021-04-28,"Rule 45-amend, subst. General Orders HF2128",Omnibus health and human services policy and finance bill
NC,S614,1491814,https://legiscan.com/NC/bill/S614/2021,https://legiscan.com/NC/text/S614/2021,2021-04-07,Ref To Com On Rules and Operations of the Senate,Feminine Hygiene Product Sales Tax Exemption
NC,S698,1492161,https://legiscan.com/NC/bill/S698/2021,https://legiscan.com/NC/text/S698/2021,2021-04-08,Ref To Com On Rules and Operations of the Senate,End Menstrual Poverty Act
PA,HB1160,1500725,https://legiscan.com/PA/bill/HB1160/2021,https://legiscan.com/PA/text/HB1160/2021,2021-04-16,Referred to FINANCE,"Providing for tax levies and information related to taxes; authorizing the imposition of a personal income tax or an earned income tax by a school district subject to voter approval; providing for education tax and for imposition of and exclusions from a sales and use tax for the elimination of residential property taxes; providing for increase to the personal income tax, for certain licenses, for hotel occupancy tax, for procedure and administration of the tax, for expiration of authority to issue certain debt and for reporting by local government units of debt outstanding; establishing the Residential Property Tax Elimination Fund; providing for disbursements from this fund and for certain rebates and assistance to senior citizens; and repealing sales tax provisions of the Tax Reform Code of 1971 and earned income tax of the Taxpayer Relief Act."
NC,H595,1501275,https://legiscan.com/NC/bill/H595/2021,https://legiscan.com/NC/text/H595/2021,2021-04-20,"Ref To Com On Rules, Calendar, and Operations of the House",Hygiene Product Sales Tax Exemption
US,SB1260,1502227,https://legiscan.com/US/bill/SB1260/2021,https://legiscan.com/US/text/SB1260/2021,2021-06-08,"Passed Senate, under the order of 5/28/21, having achieved 60 votes in the affirmative, with an amendment by Yea-Nay Vote. 68 - 32. Record Vote Number: 226. (text: CR S4049-4499)",SPACE Act National Aeronautics and Space Administration Authorization Act of 2021 Aeronautics Innovation Act National Strategy to Ensure American Leadership Act of 2021 National SEAL Act of 2021 Supporting Early-Career Researchers Act Advancing IoT for Precision Agriculture Act of 2021 Improving Minority Participation And Careers in Telecommunications Act IMPACT Act Sister City Transparency Act Shark Fin Sales Elimination Act of 2021 Combating Sexual Harassment in Science Act of 2021 Bioeconomy Research and Development Act of 2021 Space Preservation and Conjunction Emergency Act of 2021
AL,HR228,1502930,https://legiscan.com/AL/bill/HR228/2021,https://legiscan.com/AL/text/HR228/2021,2021-04-22,Jones (M) motion to Adopt adopted Voice Vote,"House of Representatives, Special Order Calendar"
OH,HB268,1503000,https://legiscan.com/OH/bill/HB268/2021,https://legiscan.com/OH/text/HB268/2021,2021-05-19,Reported: Ways and Means,Exempt sale of investment metal bullion and coins from sales tax
AL,HR251,1504947,https://legiscan.com/AL/bill/HR251/2021,https://legiscan.com/AL/text/HR251/2021,2021-04-29,Jones (M) motion to Adopt adopted Voice Vote,"House of Representatives, Special Order Calendar"
AL,HR262,1506303,https://legiscan.com/AL/bill/HR262/2021,https://legiscan.com/AL/text/HR262/2021,2021-05-17,Jones (M) motion to Adopt adopted Voice Vote,"Feminine Hygiene products, Local Board of Education, urged to have available in certain schools at no cost to students"
OH,HB292,1506972,https://legiscan.com/OH/bill/HB292/2021,https://legiscan.com/OH/text/HB292/2021,2021-11-30,Refer to Committee: Transportation,Create Electric Vehicle Commission; temporary sales tax on parts
NY,S06572,1507097,https://legiscan.com/NY/bill/S06572/2021,https://legiscan.com/NY/text/S06572/2021,2021-12-22,APPROVAL MEMO.146,"Provides feminine hygiene products at no cost to menstruating individuals in homeless shelters, including, but not limited to, sanitary napkins, tampons and panty liners."
TX,HR1898,1513265,https://legiscan.com/TX/bill/HR1898/2021,https://legiscan.com/TX/text/HR1898/2021,2021-06-03,Reported enrolled,Commending the Skyline High School IGNITE club for its campaign to make feminine hygiene products available at Dallas ISD schools.
MA,S2465,1514301,https://legiscan.com/MA/bill/S2465/2021,https://legiscan.com/MA/text/S2465/2021,2021-05-27,See H4001,Site Information & Links
US,HB3764,1515157,https://legiscan.com/US/bill/HB3764/2021,https://legiscan.com/US/text/HB3764/2021,2022-12-30,"Placed on the Union Calendar, Calendar No. 511.",Ocean-Based Climate Solutions Act of 2022
MN,HF33,1516035,https://legiscan.com/MN/bill/HF33/2021/X1,https://legiscan.com/MN/text/HF33/2021/X1,2021-06-29,Secretary of State Chapter 7 ,Omnibus health and human services bill.
AZ,HB2911,1516087,https://legiscan.com/AZ/bill/HB2911/2021,https://legiscan.com/AZ/text/HB2911/2021,2021-06-25,House miscellaneous motion: Rep. Toma moved that rules be suspended and House Bill 2911 be immediately placed under the order of business Third Reading of bills for the purpose of substitution of bills on Third Reading,Prisoners; training; individual certificates
AZ,SB1849,1516423,https://legiscan.com/AZ/bill/SB1849/2021,https://legiscan.com/AZ/text/SB1849/2021,2021-06-30,Chapter 400,Prisoners; training; individual certificates.
US,HB3975,1516801,https://legiscan.com/US/bill/HB3975/2021,https://legiscan.com/US/text/HB3975/2021,2021-06-17,Referred to the Subcommittee on Trade.,Generalized System of Preferences and Miscellaneous Tariff Bill Modernization Act of 2021
US,HB4037,1517204,https://legiscan.com/US/bill/HB4037/2021,https://legiscan.com/US/text/HB4037/2021,2021-06-22,Referred to the Subcommittee on Trade.,Trade Preferences and American Manufacturing Competitiveness Act of 2021
MA,H4002,1518928,https://legiscan.com/MA/bill/H4002/2021,https://legiscan.com/MA/text/H4002/2021,2021-07-29,Section 121 passed over veto -see  Roll Call #70 (Yeas 39 to Nays 1),"Making appropriations for the fiscal year 2022 for the maintenance of the departments, boards, commissions, institutions and certain activities of the Commonwealth, for interest, sinking fund and serial bond requirements and for certain permanent improvements"
US,HB4521,1519516,https://legiscan.com/US/bill/HB4521/2021,https://legiscan.com/US/text/HB4521/2021,2022-05-05,Message on Senate action sent to the House.,"United States Innovation and Competition Act of 2021 Cyber Response and Recovery   Act Federal Rotational Cyber   Workforce Program Act of 2021 Facilitating Federal Employee   Reskilling Act Meeting the   China Challenge Act of 2021 Trade Act of 2021 Merger Filing Fee Modernization Act of 2021 Safeguarding American Innovation Act National Risk Management Act of 2021 No TikTok on Government Devices Act American Security Drone Act of 2021 Make PPE in America Act National Aeronautics and Space   Administration Authorization Act of 2021 Strategic   Competition Act of 2021 Countering Chinese Communist   Party Malign Influence Act Build America, Buy America   Act Space Preservation and   Conjunction Emergency Act of 2021 Taiwan Fellowship Act BuyAmerican.gov Act of 2021 Advancing American AI Act Promoting   United States International Leadership in 5G Act of 2021 Securing   America's Future Act Aeronautics Innovation Act National   Strategy to Ensure American Leadership Act of 2021 Improving Minority Participation And Careers in Telecommunications Act Bioeconomy   Research and Development Act of 2021 Sister City   Transparency Act Shark Fin   Sales Elimination Act of 2021 Combating   Sexual Harassment in Science Act of 2021 Supporting   Early-Career Researchers Act Advancing IoT   for Precision Agriculture Act of 2021 Endless   Frontier Act"
US,HB4602,1519741,https://legiscan.com/US/bill/HB4602/2021,https://legiscan.com/US/text/HB4602/2021,2021-07-22,Referred to the Subcommittee on Consumer Protection and Commerce.,WIPPES Act Wastewater Infrastructure Pollution Prevention and Environmental Safety Act
DE,SB198,1520816,https://legiscan.com/DE/bill/SB198/2021,https://legiscan.com/DE/text/SB198/2021,2022-02-07,Signed by Governor,"An Act To Amend Titles 10, 11, 13, 14, 16, 29, And 31 Of The Delaware Code Relating To The Office Of Child Care Licensing."
US,SB2645,1520973,https://legiscan.com/US/bill/SB2645/2021,https://legiscan.com/US/text/SB2645/2021,2021-08-05,Read twice and referred to the Committee on Finance.,Rewarding Efforts to Decrease Unrecycled Contaminants in Ecosystems Act of 2021 REDUCE Act of 2021
MI,HB5267,1521782,https://legiscan.com/MI/bill/HB5267/2021,https://legiscan.com/MI/text/HB5267/2021,2021-11-09,Assigned Pa 108'21 With Immediate Effect,Sales tax: exemptions; sale of feminine hygiene products; exempt. Amends secs. 4a & 25 of 1933 PA 167 (MCL 205.54a & 205.75).
NY,A08264,1522199,https://legiscan.com/NY/bill/A08264/2021,https://legiscan.com/NY/text/A08264/2021,2022-03-31,advanced to third reading cal.513,"Replaces all instances of the words or variations of the words feminine hygiene products and sanitary napkins with the words menstrual products or pads, respectively, or a variation thereof."
AK,HB3006,1522560,https://legiscan.com/AK/bill/HB3006/2021,https://legiscan.com/AK/text/HB3006/2021,2021-08-31,COSPONSOR(S): DRUMMOND,State Sales And Use Tax
OH,SB221,1522816,https://legiscan.com/OH/bill/SB221/2021,https://legiscan.com/OH/text/SB221/2021,2021-09-08,Refer to Committee: Ways and Means,Expand products eligible for sales tax holiday
OH,SB222,1522849,https://legiscan.com/OH/bill/SB222/2021,https://legiscan.com/OH/text/SB222/2021,2021-09-08,Refer to Committee: Ways and Means,Provide sales tax holiday in March for Energy Star products
